3,http://lorempixel.com/300/300/people,2012-11-03,Ipsum fames. Dolor porta. Morbi purus. Magna netus. Velit netus. Felis netus magna. Lacus dolor a luctus nisi pellentesque vestibulum enim fames hymenaeos est odio. Vitae lacus metus neque hac nibh.,http://lorempixel.com/300/300/people,Charming Acres|Leeward Cove|The Lakes at Royal Dunes,Randal Needleman,Alex Groom,2012-08-26
5,http://lorempixel.com/300/300/people,2012-05-23,Etiam magna nisl leo malesuada donec ante natoque eget placerat. Netus neque vivamus vulputate sapien sagittis. Magna metus magnis proin maecenas vitae semper ut duis quis pulvinar. Massa justo. Morbi metus. Felis ipsum justo integer nibh orci. Neque ipsum dictum. Lorem curae sapien fusce ullamcorper facilisi pede.,http://lorempixel.com/300/300/people,Hunter Downs|Lonely Homestead|Passion Fruit Quay,Larue Gay,Yang Brosnan,2012-03-01
4,http://lorempixel.com/300/300/people,2012-05-07,Augue donec velit dictum urna habitasse semper. Porta vitae cum odio laoreet massa nisi eleifend faucibus risus nostra eros ullamcorper. Risus ipsum a cursus. Lorem curae leo imperdiet rutrum eni. Justo purus porta mollis nullam felis erat tellus facilisi nisl aliquam ipsum urna quam etiam mi massa. Lorem class quisque penatibus eget cras. Ipsum lacus suspendisse ve ornare. Lacus felis sem rutrum.,http://lorempixel.com/300/300/people,Wooded Pasture,Ling Mcmaster,Coral Crossett,2012-04-13
5,http://lorempixel.com/300/300/people,2012-06-03,Massa justo nulla diam eu ante cras iaculis et at mi nunc orci quam proin diam. Massa purus integer duis habitant dis nullam montes. Nulla neque ornare vehicula etiam gravida id fringilla felis elit lacus. Nulla curae felis semper ultricies phasellus risus conubia. Curae felis auctor est gravida mi sed vulputate auctor. Donec curae tellus in interdum sodales egestas. Donec etiam sit vestibulum magnis molestie. Netus morbi eget a orci felis sodales erat ac sollicitudin laoreet nulla.,http://lorempixel.com/300/300/people,Whaler's Timbers|Azalea Overlook|Muskrat Prospect,Elicia Geist,Melanie Bricker,2012-04-22
4,http://lorempixel.com/300/300/people,2013-06-16,Purus lacus nonummy arcu vel est consectetuer etiam nibh dolor mi platea at. Porta vitae condimentum id platea ac. Justo massa dictum sem posuere a condimentum non amet. Massa velit. Vitae velit lacus fusce senectus et augue massa sem adipiscing taciti nibh ante laoreet. Fusce netus interdum. Ipsum massa risus senectus porttitor. Augue neque tellus.,http://lorempixel.com/300/300/people,Porpoise Breakwater,Jonah Newsom,Bea Midgley,2013-04-19
3,http://lorempixel.com/300/300/people,2013-05-19,Massa risus hac magna vitae velit litora vehicula adipiscing vivamus per iaculis ve. Purus curae. Purus felis nec magna per parturient. Massa class. Porta donec suscipit eros faucibus. Dolor morbi eni cras aliquam ve pede quis orci vestibulum eget aenean gravida cubilia imperdiet nisl enim vestibulum. Neque massa pulvinar. Purus lorem eni.,http://lorempixel.com/300/300/people,Banyan Lagoon,Lecia Harling,Alysha Lococo,2013-02-20
5,http://lorempixel.com/300/300/people,2013-04-11,Porta purus. Neque purus. Neque curae. Justo donec fusce morbi varius urna. Nulla proin felis hac metus dignissim felis amet a cras ve. Fusce massa. Fames morbi conubia nibh class tristique proin id tristique natoque urna. Vitae porta nam aliquam suscipit lorem.,http://lorempixel.com/300/300/people,Cypress Highlands,Luise Klippel,Parker Foltz,2013-03-19
2,http://lorempixel.com/300/300/people,2012-10-18,Donec felis. Donec dolor accumsan est netus euismod nibh. Massa metus a elit parturient dis massa habitasse integer. Etiam risus libero turpis. Etiam ipsum urna ac eros venenatis varius turpis est. Felis lacus massa fames turpis eget viverra a mollis metus sed mus hymenaeos. Porta fusce. Massa augue erat facilisis mattis amet vel fusce porttitor.,http://lorempixel.com/300/300/people,Vista Fresca,Cythia Doten,Venessa Mahmood,2012-10-10
4,http://lorempixel.com/300/300/people,2012-10-09,Donec risus elit egestas eni penatibus. Nulla velit erat nec fusce porta ipsum tempus consectetuer hymenaeos lorem. Felis class. Porta justo vitae purus tellus accumsan parturient penatibus velit. Curae dolor. Fames porta lorem velit nam urna per vitae vel quis neque porttitor dui. Purus fusce. Fames nulla suspendisse nisi ultricies suscipit nostra.,http://lorempixel.com/300/300/people,Salisbury Mesa|Owl Brook|Macaw Shore,Isidro Hanlin,Henriette Diedrich,2012-09-27
3,http://lorempixel.com/300/300/people,2012-05-27,Curae netus curabitur duis eros ultricies nullam velit. Vitae metus non eros conubia ad erat dolor nullam montes porttitor morbi in curabitur. Netus dolor. Magna augue. Purus justo. Dolor lorem. Velit fames taciti pulvinar venenatis ac ad. Purus lorem dolor rutrum dolor at risus mollis nascetur.,http://lorempixel.com/300/300/people,The Inlet at Oak Vale|Sioux Promontory,Jade Clutts,Jackqueline Malagon,2012-03-21
3,http://lorempixel.com/300/300/people,2012-09-04,Massa fames nisi non posuere ad id. Justo lorem. Massa lacus. Neque etiam libero. Massa morbi a dictum eget enim augue rutrum. Augue porta. Dolor curae dictumst nisi aliquam egestas. Proin fusce sociis ve ipsum mus metus libero vivamus.,http://lorempixel.com/300/300/people,Sea Spray Breakers|Macaw Waves,Leena Newbury,Raquel Yoshioka,2012-07-02
2,http://lorempixel.com/300/300/people,2013-07-10,Nulla fames aenean dolor. Porta massa nullam duis at eros urna suscipit ve est. Netus lorem arcu sit curae luctus. Magna neque dis vitae risus integer. Augue proin. Metus purus congue dictum donec sit magna proin ante leo. Justo lacus arcu condimentum integer ullamcorper elit tortor dictumst inceptos conubia amet leo. Proin risus elit a orci proin posuere dapibus mattis hac eget dis a.,http://lorempixel.com/300/300/people,Blue Spruce Crossing|The Crag at Weaver's Abbey|Avon Creek,Tomika Shimer,Irvin Hacker,2013-05-10
4,http://lorempixel.com/300/300/people,2012-06-29,Proin massa magna sit fusce nonummy tellus cum amet ultrices. Vitae morbi. Metus nulla cum nunc ac sociosqu commodo pulvinar fames blandit. Donec curae porta inceptos non vitae eros tempus habitasse adipiscing. Purus augue praesent etiam habitasse at primis maecenas. Justo fusce quam donec platea ut orci curae eu vulputate risus. Class netus. Fames metus purus vitae dictumst hendrerit vehicula platea nisi.,http://lorempixel.com/300/300/people,Graceful Lagoon|Admiral's Island|Madera Azul,Vikki Rufus,Marget Lehn,2012-05-14
3,http://lorempixel.com/300/300/people,2012-05-08,Proin lorem dis amet. Porta purus. Lacus massa. Massa donec suspendisse in aptent et magnis class condimentum senectus felis mauris taciti. Dolor risus. Nulla vitae luctus fringilla vestibulum. Porta lacus nostra dictumst nibh ultrices vel risus tincidunt fermentum. Lorem fusce donec nec quis per sem.,http://lorempixel.com/300/300/people,Oak Rise|Mild Meadows|Palm Parish,Gary Trostle,Larry Wold,2012-03-26
4,http://lorempixel.com/300/300/people,2013-01-10,Risus fames. Class curae egestas leo accumsan a sollicitudin ante dapibus. Augue velit sem nisl enim suscipit libero nunc at. Neque donec pede a. Fames etiam. Risus lorem congue sociis volutpat. Ipsum lorem primis fusce lobortis vestibulum nullam at nibh leo augue. Velit vitae sed phasellus suscipit mollis nibh nisi porta convallis cursus platea.,http://lorempixel.com/300/300/people,Macaw Island|Gull Coast|Stafford Suburb,Adina Jezierski,Clorinda Croxton,2012-12-07
2,http://lorempixel.com/300/300/people,2012-02-28,Magna donec quis netus curabitur cum elit fusce neque montes ligula aliquam eu. Lacus fames sociis egestas varius et leo habitasse velit quis velit elit nisi. Massa velit amet cum diam a eros donec mus neque. Justo donec ultricies pede convallis. Lorem neque sociis morbi scelerisque molestie netus. Porta justo bibendum velit nisi hac quis a odio. Fames lorem tellus neque vestibulum praesent posuere nibh maecenas vitae at. Massa netus dictum vestibulum consectetuer egestas habitasse varius adipiscing sagittis egestas iaculis.,http://lorempixel.com/300/300/people,Tern Coast|Royal Abbey,Elouise Connon,Augusta Bourquin,2012-01-23
1,http://lorempixel.com/300/300/people,2012-11-08,Purus donec magnis dapibus tortor leo sociis ve semper. Etiam nulla. Augue neque a cras massa aliquam lacinia inceptos. Morbi fames condimentum ultrices ridiculus inceptos nibh mauris ligula. Fames felis. Ipsum donec lectus montes nunc scelerisque. Velit metus mus duis sollicitudin in aliquet in ad nisi scelerisque posuere ullamcorper nisi. Risus vitae mattis ridiculus lacus.,http://lorempixel.com/300/300/people,Toucan Island|Oak Orchards|Choctaw Canyon,Del Smithey,Syble Flynn,2012-10-12
5,http://lorempixel.com/300/300/people,2013-02-18,Morbi nulla. Porta lacus justo dis adipiscing vestibulum ve sagittis ante vel metus vivamus. Fames etiam. Fames morbi per enim arcu orci. Lacus lorem a erat lacus mollis in praesent quam ac. Metus ipsum aenean. Massa justo mollis. Fames class.,http://lorempixel.com/300/300/people,Mango Haven|Rambling Timbers,Arianne Ebarb,Katrina Castorena,2012-12-14
3,http://lorempixel.com/300/300/people,2012-07-16,Morbi fusce velit praesent odio sit in lectus morbi risus aliquet lacus orci leo cubilia. Massa felis dapibus et vehicula rutrum parturient. Etiam dolor felis cubilia. Neque ipsum. Felis etiam quam a lorem egestas. Risus netus. Netus justo eros elit vehicula eleifend in. Purus morbi.,http://lorempixel.com/300/300/people,Secluded Meadows|Partridge Park,Christel Henrickson,Venessa Mahmood,2012-04-24
1,http://lorempixel.com/300/300/people,2012-08-26,Velit proin ligula lorem gravida ac eu at erat libero laoreet urna magna tincidunt. Curae felis. Risus justo nam cursus dui parturient neque eget ad pede sem ridiculus eleifend nostra. Ipsum morbi vulputate eni orci vulputate id luctus senectus. Proin velit purus nostra. Class lorem erat habitant per ac congue inceptos parturient fermentum. Vitae risus aliquet ad litora pharetra nibh nec. Morbi dolor tortor condimentum augue luctus montes.,http://lorempixel.com/300/300/people,The City at Chippewa Creek|Angler's Meadows|Captain's Beach,Ellsworth Rehman,Bud Carrow,2012-08-20
2,http://lorempixel.com/300/300/people,2013-01-30,Vitae proin erat. Proin massa sit blandit augue nisi eros quisque vivamus neque. Ipsum felis cum risus metus sit nunc. Netus magna. Lorem velit netus mauris ut enim justo curae torquent dui cubilia ad in dictum ut. Porta lacus libero. Felis fames posuere. Dolor magna.,http://lorempixel.com/300/300/people,Dove Vale|Placid Junction,Eleonor Mclachlan,Terresa Cabe,2012-11-17
1,http://lorempixel.com/300/300/people,2012-11-23,Class morbi. Neque ipsum a eros in orci lacus quam auctor ut turpis blandit cubilia mauris nostra nec. Metus neque mollis fusce gravida mollis at leo tempor a. Purus felis suspendisse dui luctus a. Proin purus magnis. Donec etiam. Vitae curae magna odio at tincidunt arcu ipsum phasellus accumsan felis per lorem commodo. Magna lacus class praesent urna nec dictumst consequat a curabitur.,http://lorempixel.com/300/300/people,Wandering Lakes|Aloha Beach,Jade Clutts,Lisha Belser,2012-09-29
4,http://lorempixel.com/300/300/people,2012-07-23,Etiam purus ullamcorper eni tempor. Etiam fusce varius suspendisse proin ornare ad enim ridiculus eros. Justo neque condimentum nunc nisi erat justo dapibus eget sagittis class quisque accumsan. Justo netus. Augue lacus tempus pellentesque imperdiet proin at ultricies ad. Risus justo primis praesent suspendisse sagittis. Neque magna euismod mollis. Morbi ipsum cras ullamcorper mi tempor feugiat eu ac urna.,http://lorempixel.com/300/300/people,Darling Valley|The Estates at Old Orchards,Kamilah Croke,Elijah Manos,2012-05-11
2,http://lorempixel.com/300/300/people,2013-04-10,Class massa augue tempus ipsum tellus quis egestas proin neque aliquam commodo congue eu nisl accumsan ornare mattis. Donec porta condimentum ve libero. Etiam justo vitae porta rutrum elit nunc volutpat. Lacus purus a sapien eget ridiculus tortor facilisis. Morbi metus a dictum eros scelerisque euismod pellentesque. Fusce lorem sit vestibulum ve molestie mus. Fames magna natoque at porta nostra mattis dui blandit at eni nibh consequat. Augue donec lobortis parturient facilisis nisi nibh tempus libero.,http://lorempixel.com/300/300/people,Wooded Pasture,Randal Needleman,Coral Crossett,2013-02-24
4,http://lorempixel.com/300/300/people,2012-05-16,Class porta pulvinar phasellus mollis eleifend ad non. Fames fusce ligula parturient. Magna proin quis accumsan risus dapibus euismod lacinia tortor ve inceptos nisl nec. Morbi nulla aenean etiam quisque viverra cursus fermentum. Lacus curae non. Porta lacus velit non vulputate sapien penatibus ipsum euismod ve facilisi. Risus purus blandit ve hac. Lacus neque augue dictum at mattis.,http://lorempixel.com/300/300/people,The Glen at Blue Spruce Park,Arianne Ebarb,Nikole Frum,2012-04-22
5,http://lorempixel.com/300/300/people,2013-06-30,Justo neque velit placerat ve odio fames odio magna. Massa risus. Magna fusce dui urna in proin porttitor aliquam platea. Purus massa ante at purus praesent vel sodales torquent aptent odio eget. Ipsum fusce duis urna ultricies nostra pede sollicitudin et cubilia elit nec est. Dolor risus rutrum tortor ac orci rutrum curabitur penatibus. Donec massa accumsan parturient penatibus scelerisque sed urna. Dolor purus viverra tellus id aliquet.,http://lorempixel.com/300/300/people,Pineapple Breakers,Tyree Aumick,Gail Gatts,2013-05-15
5,http://lorempixel.com/300/300/people,2012-02-12,Nulla donec aptent cras elit lectus ac senectus potenti sapien ipsum et ligula aliquet. Vitae justo pretium ve ridiculus magna suscipit. Class donec orci ultrices duis rhoncus nibh hac metus cursus. Netus neque fringilla. Nulla curae sociosqu ridiculus. Porta class scelerisque ad montes commodo magnis ante in. Justo class pede tellus facilisi eu quam. Justo augue phasellus parturient vel adipiscing et tellus quisque tempor.,http://lorempixel.com/300/300/people,Seagull Firth|Madera Roja,Ellsworth Rehman,Contessa Venable,2012-02-09
2,http://lorempixel.com/300/300/people,2012-06-20,Augue felis ante vehicula suspendisse nec diam pellentesque interdum ipsum. Netus massa. Felis proin nisi ipsum fames a quis. Massa risus turpis pellentesque fringilla lectus curabitur in suspendisse ve varius per. Netus velit. Morbi fames aenean ridiculus nascetur dolor. Ipsum felis. Augue neque cursus dictum massa ve.,http://lorempixel.com/300/300/people,The Corner at Gentle Crag,Everett Stever,Valarie Macbeth,2012-04-03
3,http://lorempixel.com/300/300/people,2012-10-06,Velit risus purus montes pede litora malesuada nascetur tempor. Risus purus molestie urna potenti tristique diam imperdiet est pretium proin. Velit magna per eros class elementum mi. Neque purus non rutrum quisque quam a class eu taciti dolor gravida. Fames metus placerat nam class elit accumsan vehicula nulla class lacus eleifend. Netus porta eni netus ridiculus proin. Fusce neque lobortis hendrerit in eu ad diam velit. Dolor velit conubia justo dui ipsum egestas litora aenean odio arcu fames.,http://lorempixel.com/300/300/people,Autumn Timbers,Bert Kohan,Eli Henricksen,2012-07-20
3,http://lorempixel.com/300/300/people,2012-12-10,Massa felis nam. Risus etiam tellus ad pharetra pretium. Risus vitae mus cras vestibulum platea. Porta proin dictum ornare metus eros nisi. Massa fames cubilia blandit pede pellentesque ac lorem ac est eu tellus. Fusce justo facilisis tristique nisi. Risus purus lacinia mattis mi pharetra amet id magna ac. Vitae neque felis lorem.,http://lorempixel.com/300/300/people,Whistling Heath,Adina Jezierski,Norberto Dynes,2012-09-27
5,http://lorempixel.com/300/300/people,2013-01-08,Lorem metus senectus. Fames netus justo platea tristique senectus eu proin pellentesque dignissim porta. Lacus risus fusce nonummy vivamus tellus vel nascetur lacus fusce ullamcorper sed odio fusce. Netus class amet est eget parturient dictum volutpat sociis adipiscing justo vivamus. Fames neque morbi a amet ad donec ut felis imperdiet. Metus curae. Massa proin tempor sociosqu facilisis sagittis dolor placerat tincidunt congue vestibulum. Etiam curae.,http://lorempixel.com/300/300/people,Songbird Parish,Brenda Orzechowski,Natasha Goers,2012-10-19
5,http://lorempixel.com/300/300/people,2013-01-19,Nulla massa. Justo lorem fames per nunc vel class elementum fames natoque. Fames fusce magna. Felis justo rhoncus quisque tempus hendrerit dui. Class dolor netus cras per metus dis feugiat eu semper lobortis. Etiam donec pulvinar magna justo facilisi lacus augue suspendisse ut. Augue justo mollis eros id elit litora at quam enim ultrices. Velit justo sociosqu metus habitant ut magnis erat nisl.,http://lorempixel.com/300/300/people,Seagull Waves|Tern Coast|Macaw Firth,Cassaundra Ribera,Genie Gentry,2012-10-22
5,http://lorempixel.com/300/300/people,2012-08-24,Ipsum nulla metus blandit hymenaeos in phasellus ut hendrerit laoreet neque. Massa etiam aenean eros mus cubilia urna. Donec massa morbi ante aptent litora habitant adipiscing venenatis condimentum. Etiam lacus torquent id tempor. Purus netus facilisi elit per sollicitudin ut. Ipsum augue. Justo etiam a nibh ut sollicitudin dictum netus ac montes. Purus massa sagittis purus et ante erat.,http://lorempixel.com/300/300/people,Fireside Anchorage|The Woods of Crystal Cove|Puerto Bajo,Jeannette Leick,Iesha Bosque,2012-07-11
4,http://lorempixel.com/300/300/people,2013-06-12,Augue etiam sed diam nascetur adipiscing luctus proin suspendisse dictumst conubia erat. Vitae class. Magna donec magnis senectus euismod platea tellus donec pulvinar. Dolor magna auctor varius potenti eget cras tellus quam eros diam. Magna vitae vivamus sit eros maecenas tempus. Massa fames mollis ac faucibus libero cursus gravida dapibus consequat inceptos class rutrum torquent ante. Risus netus litora per. Morbi magna suscipit magna tempus class lectus elementum vivamus dolor quis sed porta cras.,http://lorempixel.com/300/300/people,The Village at Bear Firth|Bridgwater Leap|Sweet Knoll,Caprice Doris,Ronda Mandujano,2013-05-01
5,http://lorempixel.com/300/300/people,2012-04-17,Porta ipsum lectus ipsum hymenaeos molestie montes libero morbi magna est proin diam a. Metus massa. Fames magna. Felis justo. Ipsum nulla. Felis purus rutrum ve velit ad etiam tortor et eros risus donec tempor metus. Metus proin ornare inceptos hymenaeos hac elit orci ipsum proin. Lacus neque sociis.,http://lorempixel.com/300/300/people,Inviting Forest|Leafy Glade|Weeping Willow Quarter,Tyree Aumick,Joanie Beaver,2012-03-20
1,http://lorempixel.com/300/300/people,2012-06-11,Nulla proin. Nulla metus. Metus justo ullamcorper dictumst vivamus eget ultrices cum arcu. Felis fusce habitasse molestie et sit quam pharetra consectetuer varius. Magna risus orci a elit ad duis porta egestas. Massa purus magna auctor vitae parturient suscipit amet commodo. Purus lacus tempus erat montes blandit porttitor eu ut neque. Donec purus hac odio.,http://lorempixel.com/300/300/people,Admiral's Island|The Meadow at Private Abbey|Fairford Terrace,Kera Cybart,Juliane Houle,2012-04-23
5,http://lorempixel.com/300/300/people,2013-06-11,Class morbi etiam mollis sociosqu malesuada. Augue risus mollis interdum feugiat tincidunt senectus. Lacus magna montes purus sodales potenti natoque. Felis netus turpis integer conubia. Ipsum netus magna libero. Risus ipsum. Lacus ipsum sociis eget curabitur senectus. Lorem fames.,http://lorempixel.com/300/300/people,Wooded Pasture,Caprice Doris,Coral Crossett,2013-05-15
4,http://lorempixel.com/300/300/people,2012-06-13,Purus massa neque ornare at primis. Magna dolor libero. Lorem vitae lorem tellus. Fusce velit. Velit nulla risus dolor velit congue habitasse vel class vel. Netus curae class dis nisi tincidunt et urna ligula leo blandit. Nulla magna cursus tempus ultrices. Neque purus aenean suspendisse porta mollis pellentesque.,http://lorempixel.com/300/300/people,Angler's Meadows|The Villas of Dover Prairie,Tonya Mcentee,Monte Player,2012-05-17
4,http://lorempixel.com/300/300/people,2012-03-21,Fusce proin nullam arcu cras etiam. Porta class. Ipsum proin faucibus quis varius fringilla mollis torquent justo et massa. Risus vitae lobortis in diam metus porttitor consequat duis potenti posuere laoreet erat facilisi et scelerisque at. Proin ipsum amet scelerisque et congue facilisi adipiscing fringilla neque. Nulla dolor. Justo fames vitae blandit dui. Donec curae nam amet dui velit sem parturient neque nisl cubilia vitae at et elit.,http://lorempixel.com/300/300/people,Mesa Verde,Fred Victory,Linn Rideout,2012-03-03
3,http://lorempixel.com/300/300/people,2013-02-18,Metus curae. Donec magna hac dui eu congue augue elit sociis turpis risus quis dui. Class nulla sapien in. Risus justo. Justo purus sociis tortor pretium. Dolor neque ligula nulla erat lorem eu mollis sodales posuere elit. Nulla justo mus adipiscing mi vulputate lacus porttitor. Donec velit.,http://lorempixel.com/300/300/people,Lazy Bay,Allie Hance,Bethel Rispoli,2012-11-26
5,http://lorempixel.com/300/300/people,2012-08-14,Lacus purus enim integer felis eget commodo eu. Justo lorem quam pretium porttitor magnis vestibulum fusce. Donec fusce duis. Ipsum fames vel. Fames proin scelerisque accumsan fusce amet ut luctus odio. Ipsum fames porttitor penatibus ipsum habitasse quisque dolor duis urna. Velit curae turpis placerat penatibus ac fermentum a porta euismod vivamus nascetur duis. Porta donec lectus.,http://lorempixel.com/300/300/people,Catamaran Lagoon,Bert Kohan,Myrta Leftwich,2012-05-16
1,http://lorempixel.com/300/300/people,2012-06-27,Lorem vitae a ligula eros curae at. Lorem ipsum urna facilisi eu suspendisse enim duis. Fames dolor porta dolor. Massa proin dictum nisi convallis interdum accumsan lorem pede leo metus. Nulla class. Fames dolor leo quam. Risus etiam. Felis donec auctor litora.,http://lorempixel.com/300/300/people,Fireside Anchorage|The Woods of Crystal Cove|Puerto Bajo,Jennine Saephan,Iesha Bosque,2012-04-13
1,http://lorempixel.com/300/300/people,2012-10-16,Velit porta vehicula vulputate nulla neque. Felis donec vulputate nec eget facilisis ac. Purus vitae. Porta dolor praesent habitasse id diam risus nullam mattis. Felis justo nec sociosqu nonummy malesuada orci. Netus velit non cras pede tincidunt nostra eleifend felis consectetuer. Proin morbi dolor. Magna augue pulvinar.,http://lorempixel.com/300/300/people,Sioux Cottages|Wooded Point,Brenda Orzechowski,Janine Heitz,2012-07-25
4,http://lorempixel.com/300/300/people,2012-08-29,Justo massa malesuada. Donec curae duis. Felis neque fames nam amet ac nullam. Metus justo. Fames purus duis aliquet nonummy habitasse sociis cum adipiscing eu. Dolor morbi massa volutpat eu massa pellentesque ultricies. Ipsum class ipsum urna eu fusce primis varius. Risus proin.,http://lorempixel.com/300/300/people,Inviting Forest|Leafy Glade|Weeping Willow Quarter,Bert Kohan,Joanie Beaver,2012-06-21
5,http://lorempixel.com/300/300/people,2012-05-21,Augue lorem montes duis id pellentesque aenean. Purus magna tempus vestibulum. Purus curae rhoncus quisque malesuada. Class lacus eros dolor orci cum vel natoque pede. Etiam felis enim netus blandit. Netus nulla semper enim urna eros mattis eget facilisis nullam tempor sit arcu at netus. Class felis accumsan vel. Class fusce pulvinar ultricies.,http://lorempixel.com/300/300/people,Salisbury Mesa|Chippewa Promontory,Mozelle Saez,Niesha Isbell,2012-03-13
2,http://lorempixel.com/300/300/people,2013-03-14,Metus etiam felis a sodales mi risus purus metus a cras ve. Morbi justo etiam dui sit. Purus porta orci turpis torquent pharetra nulla imperdiet. Metus morbi lorem vehicula nec arcu enim amet sociis magnis pede. Nulla neque tempor velit imperdiet eni velit nisi. Porta proin primis vestibulum suscipit viverra elementum quam. Netus etiam. Lorem neque maecenas fusce ad magnis imperdiet ac nulla ad.,http://lorempixel.com/300/300/people,Sioux Cottages|Wooded Point,Birgit Shires,Janine Heitz,2013-02-11
5,http://lorempixel.com/300/300/people,2012-02-20,Magna massa varius suspendisse lorem lectus sem dui in rutrum pellentesque. Magna fames erat. Porta metus natoque quisque amet mauris nisi conubia in erat fusce et ad. Vitae etiam tortor donec sociis. Netus massa class eros. Massa augue suspendisse facilisi phasellus justo. Lacus neque sed proin iaculis diam lacinia ve et duis habitant ipsum nonummy pede bibendum. Curae proin habitasse aptent tempor.,http://lorempixel.com/300/300/people,Porpoise Quay|Windward Beach,Zoila Meadow,Lilliam Sorrells,2012-02-17
5,http://lorempixel.com/300/300/people,2012-04-16,Ipsum lorem vel metus dui phasellus. Velit dolor non. Class lacus vel. Netus purus vehicula ipsum penatibus maecenas mattis curae cubilia tellus nec auctor a. Metus augue a cras adipiscing primis dis vestibulum risus duis. Velit curae nisi purus convallis dui. Magna nulla platea dictumst facilisis urna. Ipsum fames accumsan per sociis hac lectus fringilla.,http://lorempixel.com/300/300/people,Palm Island|Macaw Anchorage|Banana Breakers,Ellsworth Rehman,Annice Elwood,2012-02-29
1,http://lorempixel.com/300/300/people,2012-11-10,Risus proin curae arcu vel massa gravida maecenas. Nulla risus eros egestas erat. Fusce lacus. Metus dolor cursus parturient lorem vivamus. Metus etiam turpis eu lobortis odio ac pellentesque mattis. Magna augue a rutrum netus feugiat nam vestibulum parturient. Morbi porta magna auctor condimentum etiam nullam. Purus vitae penatibus quis elit vestibulum.,http://lorempixel.com/300/300/people,Mild Hills,Tyree Aumick,Lurline Nickols,2012-10-03
