4,http://lorempixel.com/300/300/people,2013-04-05,Purus risus. Felis donec cras porttitor ad hendrerit a class in. Fusce risus a. Fusce purus nulla fusce sed cubilia faucibus ad scelerisque. Vitae justo. Netus vitae primis augue eleifend nisl eni duis urna viverra. Risus augue libero fringilla nullam bibendum condimentum lobortis nulla. Risus metus.,http://lorempixel.com/300/300/people,Cherokee Rock,Adriene Rizo,Tamie Kist,2013-03-31
1,http://lorempixel.com/300/300/people,2012-10-06,Fames purus. Velit neque rutrum aenean. Neque felis. Massa netus quam magnis ante tempor nulla ullamcorper praesent proin hac. Magna metus. Etiam lacus placerat per purus. Etiam velit nunc aliquet aptent diam orci senectus dapibus consequat at. Curae class eni metus nulla senectus nulla nibh magnis.,http://lorempixel.com/300/300/people,Paso Rojo,Del Smithey,Trina Studdard,2012-07-15
2,http://lorempixel.com/300/300/people,2013-02-19,Nulla fames erat lacus. Neque massa cras sodales posuere conubia nullam at lobortis egestas tellus arcu vulputate habitant ipsum purus. Magna felis. Neque proin odio potenti habitasse arcu hac arcu praesent. Metus dolor ligula nascetur lorem. Donec fusce eleifend donec ve rutrum dignissim ac. Lorem felis sem curae vel adipiscing malesuada amet egestas sem nisl maecenas. Porta morbi nibh consequat primis consequat.,http://lorempixel.com/300/300/people,Sandpiper Strand|Tern Inlet|Mariner Firth,Venessa Scull,Florene Sakai,2012-12-22
3,http://lorempixel.com/300/300/people,2012-07-23,Justo augue enim velit senectus class nisl dignissim hac metus platea quis urna felis. Metus porta dui odio non ut tempus. Donec etiam scelerisque amet hendrerit habitant curae phasellus metus eu consectetuer ornare primis. Nulla morbi. Justo nulla convallis blandit magna ac curae et facilisis a. Netus porta libero tortor. Nulla purus euismod ligula leo nisl quis euismod mi. Lorem netus.,http://lorempixel.com/300/300/people,Breadfruit Bay,Hana Turnipseed,Dyan Shay,2012-06-25
3,http://lorempixel.com/300/300/people,2012-04-14,Massa justo. Risus neque. Justo felis quam potenti in mi cras sodales et. Etiam netus varius praesent enim. Neque donec massa pretium mattis. Proin netus. Porta purus nisi. Magna lorem.,http://lorempixel.com/300/300/people,Cambridge Ridge|Lazy Butte,Everett Stever,Glennie Borrero,2012-01-31
2,http://lorempixel.com/300/300/people,2013-04-19,Lacus metus. Magna vitae. Massa dolor fusce semper tempor amet platea egestas. Fames felis taciti eu mauris. Porta proin. Curae lorem odio a eget at interdum posuere. Purus vitae. Justo class vehicula penatibus eni gravida diam magna praesent duis dis ut volutpat.,http://lorempixel.com/300/300/people,The Dale at Antelope Quarter|Avocado Delta|Tern Coast,Birgit Shires,Mavis Schramm,2013-03-21
5,http://lorempixel.com/300/300/people,2012-07-17,Lorem dolor varius ac cras potenti eu orci placerat suspendisse suscipit. Fames fusce condimentum interdum elit. Felis lacus congue. Proin curae per. Donec porta. Fusce velit ullamcorper accumsan conubia feugiat cras. Dolor fusce condimentum vel arcu urna dis laoreet. Massa nulla feugiat diam nibh ornare facilisi sed tortor.,http://lorempixel.com/300/300/people,Banyan Bay|The Acres at Leafy Ridge|Macaw Island,Lecia Harling,Francesco Marcinkowski,2012-06-23
5,http://lorempixel.com/300/300/people,2012-07-29,Lorem neque aenean eu id sapien nec aliquam litora nisi. Class curae nullam ve mattis ad aenean sem euismod dictumst. Massa fames. Curae neque a amet in diam. Dolor felis taciti magna adipiscing nascetur quam feugiat a lectus nibh consectetuer parturient odio. Curae morbi posuere rutrum etiam ornare eget eu amet nibh vulputate. Vitae proin lectus in faucibus commodo etiam. Velit class.,http://lorempixel.com/300/300/people,Banyan Bay|The Acres at Leafy Ridge|Macaw Island,Luanna Duggan,Francesco Marcinkowski,2012-06-17
2,http://lorempixel.com/300/300/people,2012-09-02,Fusce netus sem lorem. Massa fusce. Class curae nonummy. Lorem class mus amet quis potenti ultricies. Etiam metus mollis donec vestibulum ullamcorper. Massa purus. Donec dolor. Dolor porta velit cum mollis tortor lacus.,http://lorempixel.com/300/300/people,Macaw Reef|The Suburb at Evergreen Village,Virgen Brummitt,Molly Monteleone,2012-06-11
1,http://lorempixel.com/300/300/people,2013-01-19,Ipsum lorem turpis tellus nec tellus auctor. Justo class a primis dolor integer nullam ve lacinia mi integer cras. Morbi fusce. Vitae dolor platea duis cursus cubilia euismod. Purus porta magnis id maecenas leo semper senectus gravida consectetuer. Lorem massa molestie purus cubilia senectus porta id. Purus curae conubia ve ut id nisl aptent. Neque ipsum dolor facilisi velit cras.,http://lorempixel.com/300/300/people,Mild Hills,Caprice Doris,Lurline Nickols,2012-10-22
5,http://lorempixel.com/300/300/people,2013-06-17,Dolor magna vitae urna augue integer. Curae massa cum ante vel commodo et eu. Porta neque libero lorem dictum eu hac quam. Metus lacus. Velit morbi molestie cum. Proin etiam proin. Class augue justo. Netus purus.,http://lorempixel.com/300/300/people,The Prairie of Thanksgiving Gulf|Stork Haven|The Oaks at Bridgwater Vineyard,Cythia Doten,Daniel Wyrick,2013-04-30
2,http://lorempixel.com/300/300/people,2012-03-29,Risus porta tempus dis mi faucibus tortor primis urna fusce. Ipsum curae nec proin. Velit justo diam ipsum donec elit. Curae morbi massa sociis inceptos id condimentum. Donec porta dictumst. Class metus cum duis luctus phasellus ligula a vestibulum sed netus. Magna vitae dui fusce ipsum duis quis. Morbi magna condimentum nec luctus fusce faucibus.,http://lorempixel.com/300/300/people,The Vineyard at Bobcat Woods,Buddy Herrod,Timika Majors,2012-01-05
5,http://lorempixel.com/300/300/people,2013-05-09,Fusce magna. Purus metus habitasse turpis curabitur. Porta justo platea bibendum congue iaculis orci cras eros ipsum gravida. Felis porta amet pretium odio in sollicitudin turpis augue ridiculus cubilia consectetuer. Lorem augue nulla mattis sociosqu parturient lectus volutpat per. Proin curae luctus. Lacus metus taciti primis proin potenti per. Magna purus felis.,http://lorempixel.com/300/300/people,Dorset Gardens,Christel Henrickson,Justine Lett,2013-03-16
1,http://lorempixel.com/300/300/people,2012-10-21,Vitae curae. Class dolor penatibus accumsan taciti nisl pellentesque inceptos augue quis massa. Massa nulla a cursus enim elit porta ipsum nunc ad magna class placerat vitae. Augue ipsum nostra taciti tristique aliquet mus sagittis. Nulla donec netus potenti quis hac sagittis a accumsan per. Fusce ipsum. Justo fusce scelerisque enim nibh dictumst senectus et. Vitae felis a vivamus id fermentum.,http://lorempixel.com/300/300/people,Mar Blanco,Allie Hance,Leora Feinberg,2012-08-02
2,http://lorempixel.com/300/300/people,2012-02-06,Massa neque nulla ligula praesent adipiscing imperdiet condimentum facilisis quam quisque arcu nunc faucibus laoreet. Dolor metus. Dolor neque laoreet. Curae donec. Velit morbi congue orci. Velit augue hac elit nisi eni nulla adipiscing eu maecenas mus laoreet proin. Donec class. Fames felis tempor tristique quisque lorem duis hendrerit elit.,http://lorempixel.com/300/300/people,The Heath at Old Valley|Ash Dale,Maxie Hollifield,Kristeen Kindel,2012-01-18
3,http://lorempixel.com/300/300/people,2012-06-16,Magna justo est diam quis odio leo. Dolor justo ullamcorper pulvinar neque id curabitur metus tempor mattis. Magna morbi. Augue curae. Netus porta. Magna fusce. Ipsum purus dictumst. Felis donec eni vivamus id turpis.,http://lorempixel.com/300/300/people,Partridge Estates|Otter Rise|Playa Blanca,Iona Lisenby,Janet Stfleur,2012-04-27
4,http://lorempixel.com/300/300/people,2013-05-09,Morbi proin. Felis fames metus sem ante eleifend vel ipsum est vestibulum porttitor risus nisi euismod et in. Magna risus lacus curae nisl mattis rutrum. Metus justo scelerisque in libero consequat felis et mattis curae duis. Etiam proin. Morbi proin tempus pharetra nibh penatibus et ante. Fames donec netus tempor montes odio cubilia justo metus mus urna nulla auctor id. Magna morbi ridiculus molestie id taciti mi.,http://lorempixel.com/300/300/people,The Brook of Axbridge Bluff,Sindy Koller,Gus Ensign,2013-04-30
1,http://lorempixel.com/300/300/people,2012-08-12,Morbi dolor nam. Fames donec. Augue metus. Ipsum porta diam inceptos a. Velit curae leo neque ridiculus. Lorem massa condimentum at ornare porttitor lobortis libero eros cras lacinia at odio nec. Risus massa. Lorem justo eget per felis aliquet odio sagittis.,http://lorempixel.com/300/300/people,The Oaks at Firefly Quarter|Rambutan Dunes|Sweet Summit,Jennine Saephan,Elijah Fairbanks,2012-06-19
3,http://lorempixel.com/300/300/people,2012-03-18,Curae class lacinia conubia nisi non praesent. Dolor donec eros et pharetra tempus varius. Morbi metus. Class morbi conubia orci accumsan vestibulum. Justo lorem ultrices ac purus. Etiam nulla semper maecenas. Metus lacus. Etiam velit sociis sagittis nulla mi vitae.,http://lorempixel.com/300/300/people,The Park at Liberty Acres,Lucinda Stracener,Shantay Shivers,2012-01-22
2,http://lorempixel.com/300/300/people,2012-08-25,Lacus curae netus lobortis ridiculus id. Metus nulla. Velit etiam mus platea quam justo viverra integer magnis in nisl. Vitae fames hendrerit adipiscing ante ornare est quisque facilisi lacinia ornare elit. Nulla risus luctus nisi magnis in ligula eu. Class risus. Class proin diam ornare feugiat. Nulla lorem condimentum habitant urna nam quisque cras.,http://lorempixel.com/300/300/people,Admiral's Reef|Salisbury Mesa|Toucan Gulf,Charlott Rondeau,Hellen Gatton,2012-07-21
4,http://lorempixel.com/300/300/people,2012-05-08,Donec massa ullamcorper interdum. Morbi neque velit dui lorem euismod. Porta justo felis donec cubilia orci rhoncus. Augue risus nec laoreet diam id consectetuer. Vitae velit vitae cursus et bibendum nascetur tellus eros per conubia eu hymenaeos id. Morbi magna facilisi. Vitae dolor orci dui. Curae fusce auctor netus vestibulum ultrices fames aliquet phasellus.,http://lorempixel.com/300/300/people,The Knoll at Inviting Downs|Aloha Dunes|Tamarind Harbor,Lili Scally,Jarvis Nazario,2012-04-05
2,http://lorempixel.com/300/300/people,2012-06-14,Morbi proin felis dui lacus. Lorem lacus quis. Lorem curae nunc est nisl cras magna ultricies euismod pellentesque. Ipsum augue. Velit metus aliquam quam urna elementum eu. Ipsum lorem suspendisse eu ornare eu amet class sodales hac at cursus volutpat. Metus neque. Magna purus.,http://lorempixel.com/300/300/people,Valle Mariposa|Laughing Vale,Mozelle Saez,Venice Feldman,2012-05-20
4,http://lorempixel.com/300/300/people,2012-03-26,Lorem neque inceptos adipiscing. Neque morbi. Lorem massa. Etiam justo a sapien donec convallis vel. Class felis. Risus class ultrices massa nullam at netus. Class donec varius magnis magna cras vulputate tristique quam sed in a pede. Augue velit accumsan diam volutpat fringilla in ullamcorper.,http://lorempixel.com/300/300/people,Leeward Reef,Jacque Behm,Leslee Heard,2012-03-15
5,http://lorempixel.com/300/300/people,2012-07-05,Velit purus habitant etiam eros blandit mi phasellus a. Velit nulla. Fusce porta. Ipsum neque turpis et nisi nascetur magna odio. Vitae neque dui augue elementum hendrerit porta. Nulla magna. Dolor etiam eget ornare at. Donec purus ipsum dolor dui lorem.,http://lorempixel.com/300/300/people,Palm Bay,Janean Nordby,Marcia Chabot,2012-06-13
2,http://lorempixel.com/300/300/people,2013-05-13,Morbi lorem luctus pulvinar malesuada aenean vehicula mus nisi. Netus massa eget proin hymenaeos cras conubia. Proin justo nec sociis placerat facilisis sollicitudin vestibulum. Purus nulla pulvinar. Netus etiam semper eu sed. Class risus. Donec massa cursus suscipit parturient tempor suscipit neque. Proin neque lacinia urna ve class at quam.,http://lorempixel.com/300/300/people,Cherokee Rock,Larue Gay,Tamie Kist,2013-03-12
2,http://lorempixel.com/300/300/people,2013-04-30,Velit nulla amet tristique cursus faucibus quis lectus. Fames metus molestie ultricies fames a. Morbi curae ornare montes est orci bibendum pellentesque tempor lorem ac congue at ornare torquent quis. Fusce morbi aliquam lacinia congue leo et primis eni conubia. Dolor fames. Proin porta. Neque augue a turpis augue morbi tellus lectus quis tellus fringilla mi malesuada. Nulla proin conubia eni in.,http://lorempixel.com/300/300/people,The Villas at Iroquois Timbers,Carly Toro,Dewayne Sisco,2013-04-09
3,http://lorempixel.com/300/300/people,2013-01-20,Curae risus elementum. Porta velit maecenas ad ante. Vitae neque amet. Augue donec nec eget at metus quis netus tristique aenean diam ad nisi class pharetra in dui neque. Porta donec a turpis nibh. Ipsum fames natoque potenti erat torquent lorem et semper vitae. Magna velit tempus ipsum sed donec facilisis lobortis porta. Netus curae.,http://lorempixel.com/300/300/people,Pineapple Breakers,Charlott Rondeau,Gail Gatts,2012-11-07
5,http://lorempixel.com/300/300/people,2012-08-05,Purus fames quam mollis ad amet consequat leo ante proin potenti quisque. Proin justo a pede ac nibh fermentum dictum. Ipsum lorem vitae donec urna a arcu vestibulum cursus ad. Nulla morbi tortor fusce ipsum a aptent. Risus fusce leo. Ipsum magna ligula justo vel tortor volutpat porttitor sed pede. Dolor netus neque per eros libero laoreet feugiat imperdiet mollis. Risus ipsum tempus mollis phasellus sociosqu mauris ornare.,http://lorempixel.com/300/300/people,Maple Ranch|The Point at Welcome Village|Passion Fruit Breakers,Janean Nordby,Muoi Bays,2012-07-18
1,http://lorempixel.com/300/300/people,2012-08-09,Ipsum curae nisi ac eleifend pretium aptent pede ut cras ullamcorper ac. Metus donec iaculis hac lectus aliquam vivamus luctus. Dolor donec aenean mus nibh primis. Vitae metus vel adipiscing. Proin ipsum aliquet. Fusce massa. Felis fames ante purus dapibus. Magna purus nisl tortor diam mi.,http://lorempixel.com/300/300/people,Moose Crest|Parrot Dunes|The Crossing at Lonesome Village,Shauna Merkel,Matilda Redmond,2012-06-18
4,http://lorempixel.com/300/300/people,2013-05-02,Felis donec sociosqu ac ullamcorper nisl. Dolor ipsum nonummy aenean hac et. Risus neque platea senectus congue lectus fusce ut bibendum. Porta purus sociis id sociis habitasse fringilla. Lacus ipsum feugiat congue sem id. Felis purus. Morbi magna augue duis sed porttitor erat. Massa felis volutpat facilisis vitae dui diam eros integer arcu netus hymenaeos.,http://lorempixel.com/300/300/people,Hunter Downs|Lonely Homestead|Passion Fruit Quay,Zoila Meadow,Yang Brosnan,2013-02-28
3,http://lorempixel.com/300/300/people,2012-09-16,Velit metus cras conubia lacinia montes fusce lobortis proin. Nulla justo per vitae ante fringilla et. Fusce lacus aenean suspendisse donec tellus etiam. Felis risus habitant eu sem erat amet ac dictum sodales feugiat. Metus risus. Massa etiam eros ultrices facilisi. Morbi magna. Fames massa tortor condimentum fusce ornare amet.,http://lorempixel.com/300/300/people,Wandering Vineyard,Randal Needleman,Tonette Moos,2012-06-19
3,http://lorempixel.com/300/300/people,2012-05-12,Fusce neque nibh. Felis proin eni vitae class velit congue. Porta netus mauris phasellus fusce purus vel parturient adipiscing ut senectus erat vel. Massa curae per duis nisi velit maecenas per. Class nulla eget est in sollicitudin. Porta neque per odio accumsan metus at mi. Purus lorem leo eros. Morbi lacus sed eget fusce nisl inceptos.,http://lorempixel.com/300/300/people,The Glen at Blue Spruce Park,Saundra Crigger,Nikole Frum,2012-05-11
2,http://lorempixel.com/300/300/people,2012-11-26,Lorem massa nec leo consectetuer justo eu ante eu. Curae vitae dapibus turpis ipsum. Lorem class massa. Netus metus posuere. Lacus risus. Dolor metus conubia dictum vel arcu imperdiet sapien massa hymenaeos magna eu. Lorem netus. Curae fusce.,http://lorempixel.com/300/300/people,Salisbury Mesa|Owl Brook|Macaw Shore,Danette Giltner,Henriette Diedrich,2012-10-31
4,http://lorempixel.com/300/300/people,2013-03-22,Curae massa sit dui nec habitasse justo velit cum nibh pede lacinia habitasse maecenas. Fames dolor. Felis justo nunc nec praesent a pellentesque nibh ipsum aliquam iaculis. Lorem augue dapibus feugiat arcu facilisi parturient aenean eros sollicitudin mi commodo diam nisl nascetur justo pellentesque. Metus morbi eleifend nam blandit. Class proin massa taciti primis. Morbi justo vehicula ante eu quis magna imperdiet. Justo vitae sem enim.,http://lorempixel.com/300/300/people,Sunset Bay|Puerto Conejo,Dione Sharma,Kimberli Minelli,2013-01-14
3,http://lorempixel.com/300/300/people,2012-12-29,Fames dolor porttitor dolor arcu vehicula fames et nulla. Risus fusce quis bibendum vestibulum semper. Massa nulla vehicula in dolor ultricies sed blandit fusce. Vitae augue etiam arcu aenean. Neque class eros sed tempus ut ve penatibus erat eni cum ad fringilla ve. Fames porta pede. Curae lacus primis blandit id et at. Velit morbi.,http://lorempixel.com/300/300/people,Shady Pasture,Tomika Shimer,Roxann Leong,2012-11-01
5,http://lorempixel.com/300/300/people,2012-04-05,Dolor purus. Magna lacus commodo ante adipiscing. Fames justo torquent proin ad primis sagittis elit. Augue neque erat tempor sed. Lacus felis. Magna lorem. Felis dolor ullamcorper urna arcu. Purus massa egestas nunc proin fusce sem diam potenti cubilia.,http://lorempixel.com/300/300/people,Dorset Gardens,Mozelle Saez,Justine Lett,2012-03-14
3,http://lorempixel.com/300/300/people,2012-05-30,Neque magna. Augue class magna netus. Lorem etiam neque integer ornare per nunc ante arcu. Purus fames etiam est eni elementum pretium sem potenti. Donec fames tempor scelerisque velit convallis leo consectetuer. Augue class nisi inceptos justo. Felis purus. Lorem ipsum non faucibus tincidunt sollicitudin.,http://lorempixel.com/300/300/people,Weaver's Butte|Kelp Gulf|American Inlet,Luise Klippel,Shara Lamonica,2012-04-14
2,http://lorempixel.com/300/300/people,2013-03-25,Donec morbi condimentum est ve. Porta lacus sociis adipiscing curae. Morbi felis fames massa nullam adipiscing class nunc. Curae massa. Vitae etiam. Curae justo. Ipsum metus. Ipsum proin eni duis tincidunt.,http://lorempixel.com/300/300/people,Valle Viejo,Saundra Crigger,Clarice Ly,2013-02-05
4,http://lorempixel.com/300/300/people,2012-05-10,Neque massa nisl lorem molestie ultricies praesent tempor. Velit donec aenean netus condimentum habitant rhoncus laoreet ligula. Morbi risus vehicula id nam curabitur. Fames metus risus amet ornare hac aliquet a auctor cras consectetuer praesent. Ipsum augue platea senectus sed dolor convallis amet enim. Felis risus cum feugiat hac ac congue sapien imperdiet accumsan. Netus massa cum enim praesent hendrerit ve etiam. Curae lacus quis hendrerit senectus turpis.,http://lorempixel.com/300/300/people,Whaler's Cove,Dione Sharma,Silvia Miranda,2012-03-15
3,http://lorempixel.com/300/300/people,2012-05-09,Augue risus nostra sollicitudin sodales quam erat quisque ve ligula mi taciti magna. Dolor vitae ornare dictumst mi. Etiam neque per habitant sodales sociis neque rhoncus aenean. Ipsum porta. Lacus velit felis scelerisque maecenas tristique ut. Metus class. Velit lorem purus nunc mi quis arcu aliquet. Purus lorem.,http://lorempixel.com/300/300/people,Palm Bay,Laurinda Franson,Marcia Chabot,2012-04-19
1,http://lorempixel.com/300/300/people,2012-03-20,Dolor risus. Fusce nulla vehicula morbi rutrum tempor sem. Magna porta elementum parturient quis etiam. Fames ipsum mollis et urna justo. Magna lacus a mauris pede. Etiam lacus diam eni gravida a varius nunc tincidunt sociosqu ad. Felis porta potenti. Neque netus feugiat dignissim praesent.,http://lorempixel.com/300/300/people,Pueblo Nuevo,Dione Sharma,Marilynn Shier,2012-02-12
1,http://lorempixel.com/300/300/people,2012-11-13,Fusce etiam lorem natoque facilisis ut ad. Curae metus blandit et in porta turpis proin luctus parturient volutpat nulla phasellus libero ligula. Magna dolor nostra vitae mus. Lorem augue amet feugiat ut. Vitae netus a orci massa litora elit amet morbi. Neque fames montes elit sollicitudin ad ipsum tortor id luctus facilisis felis malesuada ve. Fusce magna tempor leo quisque ligula et id ornare nonummy. Felis lacus etiam integer vitae nibh viverra felis urna vivamus ut.,http://lorempixel.com/300/300/people,Magnolia Mount|Shady Pasture,Jade Clutts,Beatrice Kinne,2012-09-25
2,http://lorempixel.com/300/300/people,2012-04-17,Morbi lorem. Porta augue potenti nisi. Neque curae nec etiam mus felis vestibulum volutpat. Massa felis dictum pellentesque laoreet dis parturient adipiscing at nisl. Neque augue taciti tellus mus natoque porta velit sociis. Lacus netus sociis primis sociosqu vestibulum egestas. Massa justo. Class proin dictum tempor.,http://lorempixel.com/300/300/people,Whaler's Timbers|Azalea Overlook|Muskrat Prospect,Vikki Rufus,Melanie Bricker,2012-01-30
4,http://lorempixel.com/300/300/people,2012-05-26,Magna lacus commodo viverra aenean sem. Morbi lorem interdum orci leo conubia lacus nibh auctor. Fames fusce. Dolor donec dis massa. Lacus proin. Fames ipsum. Proin velit. Curae morbi dictumst vitae sapien neque at.,http://lorempixel.com/300/300/people,Angler's Meadows|The Villas of Dover Prairie,Kera Cybart,Monte Player,2012-03-06
3,http://lorempixel.com/300/300/people,2012-03-31,Class purus vivamus nunc. Etiam justo. Lorem fusce. Netus curae feugiat nostra metus adipiscing at phasellus risus. Nulla curae mauris maecenas urna platea. Curae justo dolor urna luctus libero nec litora curae nec fusce. Fusce velit erat fermentum lobortis interdum ipsum ve non eget urna phasellus torquent. Lorem etiam.,http://lorempixel.com/300/300/people,The Harbor at Fireside Promontory|The Estates at Spruce Brook|Sunrise Terrace,Carly Toro,Jacque Behm,2012-03-16
2,http://lorempixel.com/300/300/people,2013-02-01,Justo neque. Curae porta nulla mattis curae. Vitae massa neque augue nec erat in consectetuer natoque velit. Purus etiam interdum ac suspendisse nisi nibh risus habitasse interdum nascetur. Nulla metus rutrum ridiculus eleifend aptent duis. Metus massa lorem posuere montes sed. Lacus netus sed vestibulum class nunc vel. Magna netus.,http://lorempixel.com/300/300/people,Banana Anchorage|Rancho Blanco,Lecia Harling,Rebbecca Friedlander,2012-11-05
3,http://lorempixel.com/300/300/people,2013-03-29,Purus massa curae montes pede quam dignissim turpis. Proin massa arcu ad pellentesque ante nonummy blandit. Proin neque nascetur orci nostra vivamus blandit odio torquent. Justo proin scelerisque mi aptent est integer ultrices id. Velit vitae. Netus justo duis laoreet odio ipsum porttitor sociosqu curae ad lacus. Metus curae purus dui sit ac etiam interdum. Ipsum donec arcu faucibus leo odio ve eget luctus aliquet aliquam orci in.,http://lorempixel.com/300/300/people,Seagull Firth|Madera Roja,Mozelle Saez,Contessa Venable,2013-02-21
5,http://lorempixel.com/300/300/people,2013-04-29,Risus magna taciti tellus urna eu malesuada nunc mus. Purus massa nisl porttitor congue mi curae leo rhoncus lobortis varius laoreet. Donec netus. Purus fusce diam volutpat non egestas curae lacus. Risus fusce. Risus justo cum lacus sed vestibulum curabitur etiam odio urna dis. Velit lacus quam rhoncus laoreet mollis nulla sem. Justo augue sapien mauris dis vestibulum class cubilia magnis libero.,http://lorempixel.com/300/300/people,Toucan Island|Oak Orchards|Choctaw Canyon,Seymour Bollig,Syble Flynn,2013-03-12
3,http://lorempixel.com/300/300/people,2013-03-30,Lacus proin cum quam vel lacus sit cras ve donec eni. Class proin sit mauris mi praesent natoque diam vel etiam. Fusce metus morbi nullam donec felis rutrum eros eget feugiat. Felis lorem litora ad sit porttitor est per sit mi nostra. Neque velit pede bibendum scelerisque volutpat phasellus leo nisi erat. Felis morbi cubilia egestas lectus per eros iaculis dis torquent aliquet. Curae fusce sit lorem. Lacus felis ligula semper interdum ullamcorper.,http://lorempixel.com/300/300/people,Angler's Meadows|The Villas of Dover Prairie,Jade Clutts,Monte Player,2013-02-15
3,http://lorempixel.com/300/300/people,2012-04-28,Lacus curae aptent magnis mi enim feugiat egestas pede ad. Proin class a varius hendrerit torquent fusce vel cum sollicitudin. Neque nulla a tempus consequat ve primis non blandit turpis nam. Morbi nulla. Morbi etiam purus felis risus elementum litora varius cubilia primis. Massa dolor rutrum malesuada lobortis dolor. Lorem metus varius netus per. Ipsum magna turpis nisi magna bibendum.,http://lorempixel.com/300/300/people,Wessex Vale,Chang Morquecho,Luther Cybart,2012-03-07
3,http://lorempixel.com/300/300/people,2012-08-26,Donec dolor enim morbi congue felis. Morbi magna purus nostra tellus in. Felis morbi. Augue curae. Lorem magna hendrerit imperdiet vestibulum eros fames proin varius dictumst pretium arcu a enim. Fames morbi. Lorem risus dui convallis curae ipsum eni morbi. Risus vitae purus interdum ante dui nibh.,http://lorempixel.com/300/300/people,Sandy Haven,Ida Galang,Vena Gizzi,2012-07-25
4,http://lorempixel.com/300/300/people,2012-12-12,Velit nulla eleifend odio vivamus a suspendisse est. Morbi neque odio commodo. Massa lorem litora cursus cubilia pretium cursus eni et eros habitant ullamcorper. Magna dolor. Lacus porta. Lacus proin ornare tortor massa vel pretium massa id turpis. Curae nulla dapibus congue leo sodales pulvinar cubilia eros at pellentesque rhoncus. Proin magna primis diam ut.,http://lorempixel.com/300/300/people,The Chapel at Palm Hearth|Admiral's Island,Fred Victory,Sherika France,2012-11-10
5,http://lorempixel.com/300/300/people,2012-06-13,Ipsum purus auctor pharetra est nonummy. Donec augue. Magna curae nascetur eros vivamus et mattis elementum. Curae dolor magna. Class fames. Augue felis elit erat enim eros leo. Justo vitae auctor. Curae fames.,http://lorempixel.com/300/300/people,Lovely Knoll|Pueblo Redondo|The Farms at Castle Hills,Kemberly Lecuyer,Kelly Couto,2012-04-06
