rating,http://lorempixel.com/300/300/people,end_date,Fusce neque. Justo dolor tellus scelerisque ipsum. Justo netus laoreet erat phasellus sed nam. Class porta. Donec ipsum orci conubia tristique nunc per in. Risus curae. Metus proin. Risus morbi class ullamcorper est libero dapibus nisl enim eget commodo.,http://lorempixel.com/300/300/people,The Leap at Lazy Sanctuary,Louann Sizer,Eleanor Krajewski,start_date
5,http://lorempixel.com/300/300/people,2013-04-08,Risus velit. Fusce risus non tortor. Dolor morbi. Purus donec urna montes parturient. Proin justo arcu amet odio pede nam. Lorem massa tempus elementum ve justo. Class lacus massa rhoncus nisi varius sed arcu placerat cum orci nascetur tortor odio. Neque risus.,http://lorempixel.com/300/300/people,Lychee Gulf,Gilda Puffer,Samatha Buskey,2013-02-26
5,http://lorempixel.com/300/300/people,2012-05-17,Ipsum nulla auctor eu pulvinar elit hac amet. Lorem augue leo placerat potenti porttitor cursus molestie amet. Curae massa est duis non fames. Felis massa justo class mattis nibh felis dictum class vestibulum nascetur quis. Proin magna per enim ut pede etiam varius ac. Massa donec etiam quis leo orci parturient. Lorem neque ante ligula erat rutrum. Etiam ipsum etiam libero nulla rhoncus enim ac.,http://lorempixel.com/300/300/people,The Fields at Azalea Point|Flamingo Shore|Tamarind Quay,Ellsworth Rehman,Cinderella Laber,2012-04-03
2,http://lorempixel.com/300/300/people,2012-07-28,Etiam justo quam commodo a turpis porta est ante eros. Magna ipsum sagittis porta nec orci odio vivamus tortor. Justo velit a nostra augue fringilla. Donec justo non pede penatibus sollicitudin egestas proin. Vitae ipsum integer curabitur sed diam ve diam lacus nam turpis a. Magna justo faucibus quis. Morbi nulla blandit at interdum nisl aenean platea. Porta magna senectus.,http://lorempixel.com/300/300/people,The Villas at Iroquois Timbers,Berniece Sulton,Dewayne Sisco,2012-06-22
2,http://lorempixel.com/300/300/people,2013-05-31,Felis risus primis mollis sit auctor ad litora ad. Vitae donec a mauris elit. Netus justo fames fringilla conubia nisi amet lacinia. Lacus nulla mattis in dui nibh sagittis elit potenti ac. Proin morbi pretium rutrum sit eu fames felis sed turpis sociis convallis mi. Curae magna auctor donec scelerisque sociosqu eros taciti. Augue curae facilisi orci enim per rutrum ve ipsum eni arcu malesuada magnis sed odio cras. Metus ipsum sapien condimentum velit elementum phasellus arcu lectus eu sapien.,http://lorempixel.com/300/300/people,Whistling Heath,Maxie Hollifield,Norberto Dynes,2013-05-05
2,http://lorempixel.com/300/300/people,2012-10-17,Felis metus lacus vel urna sem vitae sem rutrum leo turpis. Proin neque nulla cum elementum libero interdum velit. Augue lacus. Velit purus. Augue velit amet dui vitae rhoncus ligula facilisis fames convallis penatibus class facilisis adipiscing pretium leo. Curae donec netus enim vivamus id fermentum. Fusce porta. Ipsum felis magna neque class nec cras per orci dictum.,http://lorempixel.com/300/300/people,Charming Acres|Leeward Cove|The Lakes at Royal Dunes,Janean Nordby,Alex Groom,2012-09-17
4,http://lorempixel.com/300/300/people,2013-01-18,Etiam augue fusce purus duis dolor laoreet bibendum felis. Fusce etiam. Risus fames risus pretium ac lacus ligula pulvinar cum. Curae etiam a posuere dictum curae lorem ligula parturient neque eros. Lacus dolor sed erat sem viverra nascetur in scelerisque ad nostra. Metus neque aptent maecenas sed quam fusce primis id arcu augue eu habitasse ullamcorper. Ipsum porta. Purus donec nunc etiam eleifend vitae sed enim sapien hymenaeos.,http://lorempixel.com/300/300/people,Thanksgiving Oaks,Jade Clutts,Frankie Desantiago,2012-10-30
2,http://lorempixel.com/300/300/people,2012-05-03,Dolor porta ligula sed diam faucibus elementum maecenas senectus conubia neque. Proin class. Ipsum velit per. Vitae netus felis odio libero laoreet. Augue felis leo etiam. Ipsum neque vehicula hac cras. Metus netus non vitae. Etiam magna maecenas et cras.,http://lorempixel.com/300/300/people,The Inlet of Thanksgiving Downs|Guava Harbor,Kenda Scarboro,Lionel Hellen,2012-04-21
3,http://lorempixel.com/300/300/people,2013-05-21,Dolor fusce mauris taciti nulla litora adipiscing pellentesque egestas. Magna curae semper suspendisse. Neque felis aenean lacus leo nisl sit ultrices etiam. Vitae curae ultrices proin a sodales nullam. Ipsum fusce magna purus torquent mi ullamcorper nunc arcu. Justo augue sociosqu curae facilisis eu. Purus dolor nisl. Fames metus sapien morbi eu.,http://lorempixel.com/300/300/people,Liberation Outlook|South Hills,Nila Styons,Armida Oddo,2013-02-21
3,http://lorempixel.com/300/300/people,2012-06-14,Fusce metus cras ridiculus convallis lorem erat senectus hac dapibus. Augue vitae molestie parturient tristique suspendisse leo rutrum fames ultricies praesent elit non lacinia molestie. Purus curae litora morbi suspendisse inceptos sodales viverra taciti dolor diam cursus. Vitae risus pulvinar curae malesuada sodales eni ad nunc netus nascetur augue ac interdum dapibus ut non. Lorem fusce aliquam nostra dui vestibulum semper proin vestibulum ullamcorper rutrum ut et ac eros augue. Lacus fusce arcu pede elementum montes. Fusce felis rhoncus non ultricies nisi eni donec est nostra rutrum. Fusce ipsum eget mus fames magna.,http://lorempixel.com/300/300/people,The Corner at Gentle Crag,Clark Groce,Valarie Macbeth,2012-04-03
4,http://lorempixel.com/300/300/people,2012-10-13,Netus nulla leo elit sed porta viverra euismod justo. Augue fames nam metus est lorem. Donec massa nam duis. Class metus pede in sollicitudin nonummy. Proin massa a arcu ve. Justo porta ligula fusce lorem aptent metus magna platea. Neque massa. Etiam neque non urna pede amet donec class.,http://lorempixel.com/300/300/people,Walrus Cliffs|The Springs at Summer Villas|Crystal Abbey,Winfred Begaye,Garry Thrall,2012-09-30
3,http://lorempixel.com/300/300/people,2013-07-01,Justo augue posuere dictum cursus nibh nulla mi consequat justo ad montes quis. Nulla risus varius nec quis vehicula integer. Purus augue per congue. Fames lorem. Proin porta dapibus at integer diam ut volutpat nostra taciti fermentum. Lorem proin dictum condimentum. Donec porta. Donec neque cum.,http://lorempixel.com/300/300/people,The Haven at Antelope Junction,Seymour Bollig,Hollie Crochet,2013-05-08
5,http://lorempixel.com/300/300/people,2012-08-20,Felis vitae rutrum senectus facilisis magna nec quam inceptos a. Donec fames fusce nulla libero bibendum conubia augue in turpis commodo odio enim leo. Etiam purus varius etiam facilisi. Metus justo leo dis pellentesque congue. Felis class sem vestibulum ac malesuada adipiscing cras vitae. Nulla fusce non cursus arcu sollicitudin parturient. Neque proin dui diam ultrices hac in a aptent eget mi. Lacus magna.,http://lorempixel.com/300/300/people,Darling Valley|The Estates at Old Orchards,Vikki Rufus,Elijah Manos,2012-05-26
3,http://lorempixel.com/300/300/people,2012-06-26,Netus curae congue aptent inceptos vestibulum cubilia amet curae sapien tortor. Dolor porta porttitor potenti. Justo dolor a euismod tortor tempor fusce ultrices. Augue lorem senectus leo. Fusce vitae lacus cras. Fames massa viverra mus quis. Magna class. Etiam curae aptent velit non arcu ac sollicitudin euismod morbi rhoncus.,http://lorempixel.com/300/300/people,The Harbor at Fireside Promontory|The Estates at Spruce Brook|Sunrise Terrace,Catherina Entrekin,Jacque Behm,2012-06-10
3,http://lorempixel.com/300/300/people,2012-10-16,Dolor curae felis dictumst ut aptent sociosqu nonummy faucibus et massa. Fames augue. Purus felis sit ridiculus odio nunc neque ac. Risus class. Fusce class morbi condimentum lobortis ultricies consectetuer. Fames velit enim libero sapien pede vivamus sed ultricies orci sed etiam adipiscing. Neque curae scelerisque eget habitasse eni vehicula aliquet dictum imperdiet proin dictumst felis. Vitae purus primis ut.,http://lorempixel.com/300/300/people,Maple Farms,Candice Vidrio,Bridgette Efird,2012-09-10
4,http://lorempixel.com/300/300/people,2013-05-23,Risus etiam erat dolor neque ultricies pulvinar netus litora. Etiam magna eget ornare non montes. Curae etiam tristique. Morbi vitae nibh scelerisque. Augue porta. Lorem massa. Felis augue ultrices adipiscing consequat enim pretium tellus. Purus vitae magna.,http://lorempixel.com/300/300/people,Banyan Bay|The Acres at Leafy Ridge|Macaw Island,Candice Vidrio,Francesco Marcinkowski,2013-03-12
1,http://lorempixel.com/300/300/people,2013-01-07,Vitae velit mus egestas ultrices. Fusce netus phasellus erat consequat mollis. Purus lacus nisi aliquam tristique quis ipsum vehicula. Dolor nulla proin consequat non. Justo velit ultrices velit ultricies vestibulum. Etiam nulla eros cursus purus tristique parturient mus donec. Proin massa. Etiam massa ultricies lorem consequat.,http://lorempixel.com/300/300/people,Sea Spray Breakers|Macaw Waves,Randal Needleman,Raquel Yoshioka,2012-10-11
3,http://lorempixel.com/300/300/people,2012-10-05,Donec porta. Netus magna. Donec etiam class eget. Augue lacus ipsum volutpat vestibulum ligula hac parturient. Fusce felis hendrerit hac. Donec proin conubia nam ad sollicitudin nisi euismod pretium orci ad hac. Neque lorem sagittis. Velit curae nam pede vestibulum mi semper dapibus elit.,http://lorempixel.com/300/300/people,Birch Estates|Oriole Valley,Mozelle Saez,Leonia Clow,2012-07-22
5,http://lorempixel.com/300/300/people,2013-04-17,Risus velit tempus non vivamus eleifend enim nam duis eros parturient cum justo. Augue etiam a sodales ac. Massa risus neque nulla ligula pede sapien ac urna. Class vitae primis orci elit aliquet. Lorem velit tempus condimentum nulla venenatis metus id aenean pulvinar parturient rhoncus eni tellus potenti in. Donec dolor eget orci cubilia porttitor quis eni blandit. Netus morbi. Massa nulla tortor vivamus hendrerit at tempus duis mauris dignissim habitant.,http://lorempixel.com/300/300/people,Puente Rojo|Moose Hearth|Seagull Landing,Tasha Dennard,Andree Kingman,2013-04-13
3,http://lorempixel.com/300/300/people,2012-12-31,Ipsum massa libero. Velit etiam metus donec ante facilisis consequat odio eget augue dictum. Magna lacus montes velit. Lacus justo maecenas fames ve sociis lacus primis. Massa etiam elit libero. Neque fusce. Lorem class nascetur tristique a neque sodales mi cum malesuada dui. Neque fames laoreet felis cras quisque et accumsan facilisi euismod odio et arcu.,http://lorempixel.com/300/300/people,Birch Vista,Tyree Aumick,Tara Johnsrud,2012-10-26
4,http://lorempixel.com/300/300/people,2012-03-04,Etiam vitae. Netus fames ligula class ut metus consequat odio. Massa morbi porta scelerisque ac nostra phasellus parturient urna tristique sem euismod. Ipsum metus. Lorem velit. Risus netus. Nulla donec. Felis fames lobortis parturient aptent felis pretium vulputate praesent nullam.,http://lorempixel.com/300/300/people,Liberty Glade|The Vale at Evergreen Junction|The Villas at Sheffield City,Vikki Rufus,Jerilyn Crowder,2012-01-25
2,http://lorempixel.com/300/300/people,2012-04-17,Curae lorem vitae risus mollis eu quis. Justo felis varius felis. Netus morbi. Magna metus a montes nibh eros vulputate libero vestibulum. Magna morbi risus est lobortis a sollicitudin amet sodales euismod. Neque dolor a rhoncus at mattis ad vel ad porta. Porta proin. Nulla neque.,http://lorempixel.com/300/300/people,The Heath at Old Valley|Ash Dale,Era Mustafa,Kristeen Kindel,2012-04-09
5,http://lorempixel.com/300/300/people,2012-01-08,Lorem justo nullam lectus proin parturient ac odio faucibus senectus taciti. Curae ipsum risus nostra taciti interdum arcu cum eros maecenas parturient varius in interdum. Fames morbi sit leo per dignissim mollis semper class elementum malesuada adipiscing nisi lorem. Velit curae rhoncus urna mi. Velit netus lacus pulvinar massa. Etiam velit orci diam. Vitae risus enim aliquam et in augue. Fames netus hendrerit.,http://lorempixel.com/300/300/people,Wandering Lakes|Aloha Beach,Kera Cybart,Lisha Belser,2012-01-07
2,http://lorempixel.com/300/300/people,2012-05-04,Purus lacus aptent ad lorem aptent libero sagittis proin. Porta proin mollis euismod cubilia enim eleifend leo blandit interdum lacus vitae. Lacus nulla faucibus. Netus justo est fusce ipsum cum. Vitae lacus luctus tempor dui rutrum iaculis commodo curabitur aptent. Vitae fames auctor libero neque donec scelerisque molestie nibh non dolor. Proin vitae orci hymenaeos dis. Proin ipsum urna quisque.,http://lorempixel.com/300/300/people,The Heath at Old Valley|Ash Dale,Sharan Fucci,Kristeen Kindel,2012-04-14
4,http://lorempixel.com/300/300/people,2012-08-28,Donec curae. Purus metus arcu ridiculus eros dui at sapien a torquent vel egestas nunc ipsum id tempus magna. Dolor purus nam. Lorem velit. Justo magna purus amet tellus dignissim facilisi luctus volutpat. Netus massa nisl nec dictumst curabitur accumsan duis arcu id diam cras risus. Velit morbi fringilla. Purus porta.,http://lorempixel.com/300/300/people,Maple Ranch|The Point at Welcome Village|Passion Fruit Breakers,Cythia Doten,Muoi Bays,2012-08-27
4,http://lorempixel.com/300/300/people,2012-02-29,Felis magna eget feugiat ac dis curabitur pharetra augue porta litora id bibendum orci per augue sit odio diam facilisi. Neque porta. Porta neque. Porta massa. Felis proin sociis condimentum neque varius mollis. Curae fusce hac augue hac orci nascetur. Fames metus odio. Metus curae neque dictum sociis inceptos imperdiet.,http://lorempixel.com/300/300/people,Mild Hills,Ellsworth Rehman,Lurline Nickols,2012-02-04
5,http://lorempixel.com/300/300/people,2012-07-21,Donec lacus. Risus netus felis. Metus morbi diam nonummy in. Felis dolor egestas penatibus cum velit elementum nostra interdum velit tristique parturient orci morbi porta. Velit donec. Metus risus tellus montes nam amet leo ornare. Donec ipsum aliquam tempus amet et metus tellus. Felis purus iaculis mattis pede eu senectus aptent tempor dui cum potenti.,http://lorempixel.com/300/300/people,Breadfruit Bay,Chang Morquecho,Dyan Shay,2012-04-22
4,http://lorempixel.com/300/300/people,2013-02-19,Etiam donec proin felis sociis porttitor ac fringilla augue. Massa etiam proin felis sociis nisi et pellentesque commodo elit ultrices. Nulla ipsum risus aenean tortor quisque aliquam varius nibh consectetuer. Magna lacus fringilla malesuada. Lacus magna a diam lacus laoreet tellus. Justo vitae. Metus lorem. Lacus netus eleifend nam litora sociis sit leo.,http://lorempixel.com/300/300/people,The Homestead at Summer Promontory|Shady Anchorage,Sindy Koller,Herma Yocum,2012-12-29
2,http://lorempixel.com/300/300/people,2012-04-14,Nulla ipsum posuere tellus vel vestibulum. Proin metus dictumst duis at duis tellus feugiat nunc quis amet. Curae massa. Felis dolor suspendisse sem mauris ut inceptos pede. Lacus proin pretium metus vel. Velit augue non nisi ac sem. Vitae metus est magna imperdiet eu. Class dolor sociis pharetra morbi class aptent scelerisque fames tempus mi faucibus nisi litora.,http://lorempixel.com/300/300/people,Maple Ranch|The Point at Welcome Village|Passion Fruit Breakers,Lonnie Rye,Muoi Bays,2012-02-24
4,http://lorempixel.com/300/300/people,2012-12-17,Lorem augue elit nec sodales sociis class suspendisse. Netus augue facilisi justo sapien quis consectetuer. Massa vitae mus nibh nunc class sagittis netus consectetuer. Lacus dolor class. Neque ipsum dolor sociis consequat sodales nulla integer est. Lorem purus pede mauris magnis. Justo curae semper ve. Nulla proin vel erat sit tempor dictum per elit dis nunc.,http://lorempixel.com/300/300/people,Liberty Corner|Poplar Highlands,Adriene Rizo,Lillian Ristau,2012-11-23
5,http://lorempixel.com/300/300/people,2013-01-03,Fames vitae. Nulla proin auctor fermentum. Neque netus montes aenean sagittis adipiscing litora nunc quam ligula ac hac erat elit aliquam. Magna nulla litora orci ante quisque convallis. Curae purus tempus. Augue proin nulla nam velit magna tempus facilisi vestibulum luctus. Class donec a odio dolor fermentum per. Etiam donec curae hac risus.,http://lorempixel.com/300/300/people,Spring Sanctuary|Sandpiper Pier|Lazy Vineyard,Tomika Shimer,Marybeth Sinquefield,2012-10-31
3,http://lorempixel.com/300/300/people,2012-04-01,Justo risus per netus fames a mattis eros urna ante phasellus sagittis quis. Vitae velit lacus faucibus venenatis sed nascetur ultricies. Felis morbi eget eni a lectus odio nibh ipsum fermentum penatibus nisi quam. Purus augue a eros porta sed. Curae vitae. Porta risus. Fusce donec eni. Magna neque aptent platea netus.,http://lorempixel.com/300/300/people,Palm Bay,Tyree Aumick,Marcia Chabot,2012-03-10
5,http://lorempixel.com/300/300/people,2013-05-24,Magna neque aptent aenean nascetur adipiscing aptent. Dolor risus a natoque eu class suspendisse. Purus fames ultricies. Massa risus ornare ligula fames. Fusce porta pharetra parturient semper. Magna dolor. Porta neque nonummy tortor at pulvinar nec nulla justo. Proin ipsum.,http://lorempixel.com/300/300/people,Valle Mariposa|Laughing Vale,Rodrick Turberville,Venice Feldman,2013-03-18
1,http://lorempixel.com/300/300/people,2012-11-14,Morbi netus sociosqu consequat eu auctor eu enim purus ridiculus. Ipsum fames. Metus fusce. Morbi felis nostra et lorem mi risus ad. Curae donec. Risus ipsum eget auctor potenti feugiat auctor orci. Fames nulla. Nulla vitae sagittis et elit.,http://lorempixel.com/300/300/people,The Park at Sweet Vista,Gary Trostle,Elease Mullen,2012-10-01
5,http://lorempixel.com/300/300/people,2012-09-06,Felis lacus feugiat eu purus ac urna ullamcorper dapibus pellentesque laoreet. Massa magna. Fames vitae convallis sem consectetuer auctor ipsum. Justo massa potenti feugiat eleifend. Lacus class mauris mi vel auctor egestas potenti class et nunc pulvinar. Ipsum magna dictumst phasellus. Dolor purus gravida non libero dapibus nunc non tristique. Etiam risus.,http://lorempixel.com/300/300/people,Wandering Lakes|Aloha Beach,Seymour Bollig,Lisha Belser,2012-07-11
4,http://lorempixel.com/300/300/people,2012-08-10,Massa magna. Lorem metus. Vitae lacus quam lobortis a pellentesque enim. Netus proin. Proin magna. Porta nulla tempus proin eu lacus eu dis hymenaeos semper placerat amet. Ipsum etiam arcu feugiat vitae eget vitae accumsan porttitor. Ipsum proin.,http://lorempixel.com/300/300/people,Paso Rojo|Axminster Crag,Winfred Begaye,Jackeline Silvernail,2012-06-29
1,http://lorempixel.com/300/300/people,2012-05-31,Nulla massa a eros donec facilisi. Metus porta ridiculus. Lorem neque per faucibus a lobortis odio. Justo lorem congue sociosqu ante. Nulla magna. Metus felis. Proin nulla a gravida eu magnis ut taciti arcu ut magna metus magnis luctus nisi enim. Metus vitae per duis pharetra hymenaeos a ipsum nonummy at habitasse.,http://lorempixel.com/300/300/people,Mild Hills,Aja Hesler,Lurline Nickols,2012-04-10
4,http://lorempixel.com/300/300/people,2012-12-03,Etiam dolor metus suspendisse ac ligula ridiculus velit eu mollis cum integer enim consectetuer. Class donec purus tortor at. Class fusce mus felis nulla ipsum nam. Netus morbi tempor dictum neque consequat dis non. Netus ipsum montes aptent neque vestibulum et lobortis posuere. Vitae ipsum nam enim gravida sed. Morbi donec ultrices ac suspendisse in tempus. Nulla morbi nullam quis.,http://lorempixel.com/300/300/people,Seaford Inlet|The Forest at Essex Knoll|Kissing Cave,Catherina Entrekin,Meta Thomure,2012-10-11
5,http://lorempixel.com/300/300/people,2012-06-10,Massa class velit odio. Curae magna mauris aptent at donec sollicitudin. Risus nulla lacinia per placerat laoreet sodales lectus quam egestas. Nulla dolor aptent id faucibus lectus enim. Metus porta per vestibulum. Velit augue per cras nunc justo nostra vestibulum consectetuer quisque. Risus massa semper donec leo blandit ut urna nunc. Morbi fusce consequat rutrum elit eros felis fusce eros.,http://lorempixel.com/300/300/people,The Village at Queensborough Gardens|Songbird Parish|The Valley at Navajo Chapel,Carolann Stimage,Angelic Koonce,2012-03-22
3,http://lorempixel.com/300/300/people,2012-07-18,Felis proin duis morbi metus a aliquet eu faucibus eros viverra fusce amet. Augue class duis mi class tellus. Porta velit montes dictum elit suspendisse vel et a enim felis. Massa felis quam commodo. Lorem vitae posuere ante vestibulum nam parturient etiam arcu volutpat suspendisse. Vitae lorem. Fames metus lacus sed. Nulla risus potenti elit eu donec.,http://lorempixel.com/300/300/people,Axbridge Homestead,Winfred Begaye,Kia Vandam,2012-05-24
3,http://lorempixel.com/300/300/people,2012-02-21,Proin purus. Nulla dolor ultricies vivamus hac ultrices natoque. Lorem donec ligula mattis mus. Risus porta scelerisque. Porta massa a aenean erat at sollicitudin natoque eni eleifend porttitor libero curae massa. Purus nulla senectus tristique luctus molestie cras varius praesent tempus luctus. Lorem nulla metus nunc orci nec gravida. Metus nulla dis mattis mi mauris a parturient sed fusce.,http://lorempixel.com/300/300/people,The Prairie of Thanksgiving Gulf|Stork Haven|The Oaks at Bridgwater Vineyard,Elicia Melecio,Daniel Wyrick,2012-01-29
1,http://lorempixel.com/300/300/people,2012-05-08,Purus porta dolor. Donec nulla. Neque etiam. Justo porta amet lacus magna sociosqu proin ad justo tellus nullam augue. Lacus curae. Curae purus ultrices nulla in ad tellus ve maecenas. Magna netus porta nam cras ligula augue pulvinar at condimentum ad. Lacus dolor orci eni.,http://lorempixel.com/300/300/people,Mar Verde|Aloha Cove,Randal Needleman,Tristan Teaster,2012-02-27
1,http://lorempixel.com/300/300/people,2013-04-15,Vitae class sed elit donec lectus platea hac ut facilisi. Etiam lacus lectus mattis elementum id malesuada ve ornare a torquent nec velit vulputate aliquet litora lacus non. Donec class faucibus nulla pellentesque tristique. Lorem justo nostra lacinia ligula eros varius vestibulum nascetur nibh sem. Ipsum nulla maecenas tincidunt sollicitudin vestibulum eros imperdiet id. Velit justo auctor urna etiam eleifend. Justo morbi nostra. Vitae justo ornare suspendisse risus.,http://lorempixel.com/300/300/people,The Hills at Poplar Summit|Welcome Lakes,Ida Galang,Rolando Bjornson,2013-03-22
3,http://lorempixel.com/300/300/people,2013-08-02,Velit proin. Magna vitae cursus id habitant nibh consequat eu odio gravida lorem per. Class neque ullamcorper vel nibh erat ornare tristique fusce lobortis et. Magna dolor ornare litora etiam nostra sed in gravida duis ad. Curae netus nullam donec adipiscing euismod eni sagittis integer. Class nulla quisque sapien. Morbi fusce. Neque vitae.,http://lorempixel.com/300/300/people,Rancho Grande,Corliss Jolin,Altha Ahumada,2013-05-05
4,http://lorempixel.com/300/300/people,2012-04-23,Proin morbi faucibus eu nulla consectetuer elementum ornare proin cum. Felis justo pede posuere phasellus odio mus. Proin magna sodales litora nisi at nunc. Lacus ipsum accumsan metus justo nisi ac etiam leo. Augue ipsum suscipit mus netus parturient ac. Augue porta mauris auctor fusce adipiscing. Fusce magna bibendum. Augue nulla senectus in.,http://lorempixel.com/300/300/people,Dusky Vineyard|Madera Grande|Shady Pasture,Gilda Puffer,Henry Dew,2012-02-24
3,http://lorempixel.com/300/300/people,2012-02-15,Neque fames. Netus dolor lectus cras. Velit risus. Risus proin aptent et accumsan rhoncus mi mattis nascetur sem. Porta ipsum. Fusce felis netus. Neque massa suspendisse molestie pede malesuada aenean molestie adipiscing semper dolor conubia. Curae massa conubia dui parturient tempor at sapien venenatis rhoncus.,http://lorempixel.com/300/300/people,Sea Spray Breakers|Macaw Waves,Jo May,Raquel Yoshioka,2012-01-08
3,http://lorempixel.com/300/300/people,2012-04-28,Dolor etiam. Porta metus proin lacus neque sodales aliquam. Netus dolor tortor et ante felis. Proin ipsum odio ultricies. Augue magna ipsum morbi velit nostra ornare pede tempor eu. Dolor augue a rhoncus. Curae augue. Morbi metus lobortis fames ad fermentum scelerisque habitasse duis vitae.,http://lorempixel.com/300/300/people,Dusky Vineyard|Madera Grande|Shady Pasture,Birgit Shires,Henry Dew,2012-04-17
2,http://lorempixel.com/300/300/people,2012-04-04,Justo fames. Etiam nulla felis eni morbi fames eni amet. Vitae velit a dapibus lectus pede ridiculus. Porta neque. Augue velit scelerisque orci pede nonummy cubilia nostra nisl elit diam. Magna netus nibh tempus volutpat. Lorem class nam proin semper pellentesque. Lacus vitae a nisi nulla lorem libero senectus magnis tellus.,http://lorempixel.com/300/300/people,Sailor's Firth,Fred Victory,Bennett Rieder,2012-03-25
3,http://lorempixel.com/300/300/people,2012-12-19,Magna class mollis. Donec fusce. Felis massa phasellus posuere magna nisi ullamcorper posuere scelerisque. Neque porta est. Lacus nulla tempus id ac imperdiet. Class proin suscipit nec porta. Ipsum class dis curae magna placerat augue ipsum. Morbi nulla pharetra sem ad primis eu lacus faucibus metus nec.,http://lorempixel.com/300/300/people,Starling Outlook|Admiral's Island,Tonya Mcentee,Yolanda Stlouis,2012-11-12
3,http://lorempixel.com/300/300/people,2012-03-27,Magna vitae odio amet commodo euismod elit eu mollis praesent ullamcorper sed dictum et dolor. Proin purus donec. Augue curae. Neque lorem eros cubilia ad. Magna neque. Dolor proin. Dolor lorem. Vitae class fusce odio tristique molestie magnis rutrum vitae.,http://lorempixel.com/300/300/people,Banyan Pier,Berniece Sulton,Reggie Sturgill,2012-01-02
1,http://lorempixel.com/300/300/people,2012-07-18,Felis donec. Class vitae metus nunc congue ut diam curae fusce. Curae donec blandit semper ad. Nulla metus suspendisse eget quis cubilia vitae elit litora hac. Velit porta ornare rutrum laoreet eu ve amet faucibus. Fames etiam augue cum nisl adipiscing curabitur eget. Metus risus donec. Augue ipsum maecenas non feugiat id morbi ut cras mi dictumst.,http://lorempixel.com/300/300/people,Admiral's Island|The Meadow at Private Abbey|Fairford Terrace,Lucinda Stracener,Juliane Houle,2012-05-03
