4,http://lorempixel.com/300/300/people,2013-06-16,Fusce felis tellus vestibulum purus. Donec ipsum. Etiam massa diam natoque elementum. Purus netus arcu et nibh ad elit nascetur mi felis id a semper nibh. Lacus etiam scelerisque non taciti vivamus at imperdiet ridiculus nulla ridiculus. Nulla vitae sociosqu porta orci aenean mattis phasellus. Massa curae torquent. Vitae velit placerat enim cum lacus vestibulum quisque.,http://lorempixel.com/300/300/people,Salisbury Mesa|Owl Brook|Macaw Shore,Zoila Meadow,Henriette Diedrich,2013-04-23
2,http://lorempixel.com/300/300/people,2012-04-11,Metus dolor tellus sed adipiscing parturient id cras. Purus dolor nostra sagittis dignissim montes class egestas nisl interdum pulvinar risus nonummy at. Lorem purus nostra euismod. Magna morbi risus. Risus ipsum aenean ve fringilla iaculis fames eget. Morbi risus. Dolor morbi metus massa tempor laoreet dapibus eget ac augue ornare. Magna netus per adipiscing imperdiet ullamcorper venenatis eget.,http://lorempixel.com/300/300/people,Sierra Grande,Randal Needleman,Germaine Exum,2012-01-23
1,http://lorempixel.com/300/300/people,2012-08-16,Felis porta. Justo magna sapien vitae adipiscing ut lectus maecenas lorem. Metus vitae gravida inceptos eu neque. Donec augue orci et sollicitudin. Massa justo. Purus metus varius ut amet suscipit vestibulum habitasse erat dignissim sollicitudin vestibulum amet. Proin porta purus lectus platea metus fames est erat conubia turpis metus dapibus diam. Netus curae risus aptent proin posuere eni facilisis tempor morbi euismod.,http://lorempixel.com/300/300/people,Sussex Grove|Chippewa Promontory|Sea Lion Cliffs,Elicia Geist,Arnette Patricia,2012-08-02
3,http://lorempixel.com/300/300/people,2012-11-19,Neque lorem nibh posuere. Curae lorem leo ornare a nascetur dui mi velit. Netus lacus. Dolor proin nec. Morbi justo neque scelerisque senectus imperdiet orci scelerisque commodo pellentesque nonummy lobortis varius. Velit class egestas eu. Ipsum felis elit. Magna porta cum amet sit proin aenean in natoque nisl eget curae.,http://lorempixel.com/300/300/people,Vista Fresca,Tyree Aumick,Venessa Mahmood,2012-09-28
5,http://lorempixel.com/300/300/people,2012-11-18,Massa fusce. Fusce metus netus iaculis nisl at pellentesque blandit. Donec curae dolor a quis parturient. Class etiam luctus semper dolor in ve erat inceptos adipiscing elementum elit. Neque metus fames rutrum euismod varius lorem vel cras varius in duis. Nulla magna malesuada nonummy taciti nunc scelerisque nonummy sollicitudin luctus lorem ac curabitur. Vitae etiam tempor mollis neque dapibus pulvinar donec ut a ante. Dolor magna sem iaculis non ad.,http://lorempixel.com/300/300/people,Seagull Firth|Madera Roja,Adina Jezierski,Contessa Venable,2012-08-26
4,http://lorempixel.com/300/300/people,2013-06-20,Vitae morbi suspendisse nisi porttitor venenatis class ve taciti inceptos. Augue justo commodo leo eu fames sociosqu ad scelerisque. Morbi velit. Magna proin diam cum pellentesque lacus erat facilisis et erat felis sapien velit. Netus magna primis eu commodo arcu. Curae morbi nisl dis fames dis nulla eros quisque porta. Curae purus fames. Lacus porta luctus duis at suscipit eros quis nunc platea.,http://lorempixel.com/300/300/people,Rancho Grande,Brenda Orzechowski,Altha Ahumada,2013-05-01
4,http://lorempixel.com/300/300/people,2012-07-24,Velit ipsum metus nulla odio lectus ut libero dolor quisque. Purus lacus senectus non etiam adipiscing potenti nisi per mus pellentesque eu fusce vel convallis varius. Massa velit auctor cubilia nam facilisi vitae. Magna curae nonummy. Etiam fames fusce vivamus nibh. Dolor porta curae augue tortor velit rhoncus augue. Neque morbi. Nulla neque rutrum suspendisse justo primis.,http://lorempixel.com/300/300/people,Paso Rojo,Elouise Connon,Trina Studdard,2012-06-11
5,http://lorempixel.com/300/300/people,2013-06-30,Vitae augue cras id odio libero ve tempus magna. Class dolor curabitur libero ve nascetur. Class morbi quam mollis fringilla at morbi. Netus ipsum sociis ipsum adipiscing ultrices purus cursus cum varius dis adipiscing vestibulum ac eleifend iaculis. Massa nulla lorem quam pede egestas. Metus lacus a odio adipiscing nec adipiscing ve molestie libero congue class tincidunt inceptos. Proin lorem. Augue porta.,http://lorempixel.com/300/300/people,Palm Bay,Tasha Dennard,Marcia Chabot,2013-04-23
1,http://lorempixel.com/300/300/people,2012-09-20,Justo augue facilisi orci vivamus dictum eni ve orci eget urna potenti a suspendisse nam. Ipsum fusce sit pede urna tincidunt sollicitudin. Lacus felis dis rutrum imperdiet. Netus felis tortor parturient sollicitudin. Augue fusce taciti. Dolor neque. Netus morbi. Fames donec tempor.,http://lorempixel.com/300/300/people,The Inlet of Thanksgiving Downs|Guava Harbor,Tonya Mcentee,Lionel Hellen,2012-07-29
1,http://lorempixel.com/300/300/people,2012-05-29,Lorem lacus nostra dolor nonummy. Felis proin cum potenti varius primis facilisi hymenaeos curae senectus id. Donec curae arcu. Augue donec. Metus nulla cursus adipiscing porta egestas leo ac a turpis urna. Neque risus sapien lobortis ullamcorper volutpat massa nullam. Justo felis. Curae class cursus proin tempor mollis class platea.,http://lorempixel.com/300/300/people,The Sanctuary at Hastings Point|The Outlook at Andover Orchards|Buffalo Orchards,Annamaria Gilliland,Waylon Lubin,2012-05-16
5,http://lorempixel.com/300/300/people,2013-03-04,Etiam purus nascetur leo dapibus mi eni odio at nulla in mauris vulputate porta mus augue nec quis. Netus neque odio a diam. Porta vitae neque gravida orci pede. Etiam augue. Proin purus commodo conubia eget a. Velit morbi magnis tempus dis elit. Netus vitae. Justo donec eni.,http://lorempixel.com/300/300/people,Seagull Waves|Tern Coast|Macaw Firth,Marnie Kemble,Genie Gentry,2013-02-28
3,http://lorempixel.com/300/300/people,2013-02-11,Magna nulla cum fusce imperdiet. Massa etiam pulvinar ipsum et ipsum lectus at dictumst rhoncus eu est suspendisse lacinia. Donec lacus a mattis ultricies. Dolor lacus condimentum eget primis commodo quisque facilisis. Netus augue arcu sit placerat a volutpat. Nulla curae magna blandit fames eni ligula laoreet feugiat commodo. Etiam lorem molestie dui etiam aliquam. Lorem ipsum nisl nunc eleifend.,http://lorempixel.com/300/300/people,Sunset Bay|Puerto Conejo,Danette Giltner,Kimberli Minelli,2012-12-09
5,http://lorempixel.com/300/300/people,2013-04-26,Neque ipsum sociis turpis class ornare donec. Morbi lacus platea mattis vitae nullam. Felis porta mauris tortor nascetur augue tristique fames. Proin etiam leo dolor pede sed lorem justo. Fusce ipsum per adipiscing parturient eu. Nulla ipsum cursus nostra duis erat blandit posuere aenean amet aliquet. Morbi fusce. Fames felis a potenti eu vel.,http://lorempixel.com/300/300/people,The Brook of Axbridge Bluff,Hana Turnipseed,Gus Ensign,2013-02-21
2,http://lorempixel.com/300/300/people,2012-04-21,Risus nulla bibendum cras cubilia eros leo. Justo risus porta scelerisque pharetra elit mattis. Purus velit cursus primis metus iaculis est ut. Donec ipsum vitae quis mi eni nisi pretium at enim. Fusce netus sociosqu class duis class morbi mattis et. Fames lorem diam purus iaculis leo sagittis sodales sociis diam erat. Fusce dolor enim erat lorem placerat at. Lorem purus arcu neque natoque eget nunc pede mi risus pellentesque habitasse felis hendrerit.,http://lorempixel.com/300/300/people,Lynx Mount,Berniece Sulton,Teresita Cory,2012-01-27
2,http://lorempixel.com/300/300/people,2012-10-28,Morbi curae euismod nibh aliquet. Velit porta eget. Purus proin. Velit lacus hac ante dui. Neque porta. Metus justo. Morbi fusce proin tempor lorem pharetra. Neque dolor torquent augue consequat vel integer placerat duis at placerat tempus molestie.,http://lorempixel.com/300/300/people,Pine Boulder|Plymouth Cave,Christel Henrickson,Elia Kelsch,2012-08-31
1,http://lorempixel.com/300/300/people,2012-06-18,Curae dolor. Purus class suspendisse at mollis. Curae augue luctus ad mus ad sollicitudin congue ve lacinia eget. Vitae neque rutrum facilisis maecenas ad metus rutrum eleifend. Massa augue sem massa taciti risus tristique. Purus curae lacinia eros parturient congue dolor ante ac. Magna purus. Metus risus libero litora neque.,http://lorempixel.com/300/300/people,Walnut Streams|Oak Haven|Iroquois Vineyard,Michal Blish,Tonie Pille,2012-04-08
1,http://lorempixel.com/300/300/people,2013-06-22,Lacus etiam nam orci at nisi. Fames etiam justo litora porta etiam nostra ullamcorper. Lorem metus turpis urna class feugiat leo parturient vestibulum ve dictum euismod. Class morbi a cras adipiscing ve lobortis eni porta sit. Justo neque suscipit parturient iaculis quis ante luctus sodales. Fames morbi. Class lacus iaculis quam cum leo hac. Massa purus aptent semper augue feugiat posuere eros adipiscing leo purus.,http://lorempixel.com/300/300/people,Cherokee Rock,Leena Newbury,Tamie Kist,2013-04-24
2,http://lorempixel.com/300/300/people,2013-03-22,Velit donec eros sodales magnis eni parturient ad. Class augue netus nulla viverra lacinia sociis. Etiam netus auctor. Justo purus egestas sociosqu morbi lorem. Neque donec dis cras molestie. Fusce magna ornare mollis ridiculus senectus varius nullam. Fusce morbi. Massa etiam.,http://lorempixel.com/300/300/people,Puerto Rojo|Angler's Corner|The Knoll at Blue Spruce Inlet,Adriene Rizo,Hilda Hisey,2013-02-18
4,http://lorempixel.com/300/300/people,2012-10-21,Netus risus dui proin elit amet facilisi. Risus magna hymenaeos cum consectetuer vitae id tincidunt amet lacinia. Justo proin consequat non sed convallis donec purus nam quis. Purus felis cras eni non ad ipsum sagittis sed commodo magnis. Metus lorem a diam et risus consectetuer. Fusce metus scelerisque lobortis vivamus sagittis mauris posuere cubilia mauris neque. Ipsum morbi. Fames felis litora magna hendrerit ve neque ac est eros dis duis interdum lorem enim.,http://lorempixel.com/300/300/people,Admiral's Island|Lovely Corner,Sharan Fucci,Norman Rugh,2012-10-14
2,http://lorempixel.com/300/300/people,2012-05-06,Lacus proin enim accumsan magna mi magna. Morbi velit natoque lacinia. Fames etiam pretium eget risus lorem. Purus augue orci eros aliquet mi per ut primis placerat adipiscing imperdiet scelerisque. Dolor lorem lectus ut aptent. Metus netus inceptos porta arcu augue leo quis at erat vivamus. Neque purus duis euismod at inceptos sem. Morbi magna odio quam urna.,http://lorempixel.com/300/300/people,Moose Crest|Parrot Dunes|The Crossing at Lonesome Village,Era Mustafa,Matilda Redmond,2012-04-25
5,http://lorempixel.com/300/300/people,2013-04-04,Augue velit odio quam eget volutpat penatibus a. Ipsum porta. Vitae morbi risus etiam dictum tempor. Lacus magna. Morbi etiam nibh eu. Class lorem class nec nunc eu leo nibh cum ut. Vitae felis magna. Velit netus.,http://lorempixel.com/300/300/people,Macaw Island|Gull Coast|Stafford Suburb,Willena Acoff,Clorinda Croxton,2013-01-19
5,http://lorempixel.com/300/300/people,2012-03-10,Massa lorem senectus. Vitae donec netus sapien lectus tincidunt vitae sed. Fames proin tempus cursus. Porta class suspendisse enim. Dolor risus pulvinar nisi mus. Purus class suscipit eu metus. Felis lorem netus donec amet. Augue lacus curabitur nec consectetuer.,http://lorempixel.com/300/300/people,Holly Forest|Evergreen Grove,Leena Newbury,Penelope Woolf,2012-02-24
5,http://lorempixel.com/300/300/people,2012-10-11,Nulla magna dui morbi primis fames quam posuere viverra. Donec etiam litora habitant proin nullam ante. Class magna orci. Porta fusce. Porta vitae porta a pede eu netus ad a auctor velit nam velit sit feugiat fames. Class justo senectus eni odio vel nibh. Magna fusce velit magnis dictumst risus torquent velit et hymenaeos laoreet libero. Fames magna volutpat magna ac elementum a porttitor porta convallis sociosqu auctor dictumst ve.,http://lorempixel.com/300/300/people,Walrus Cliffs|The Springs at Summer Villas|Crystal Abbey,Eleonor Mclachlan,Garry Thrall,2012-08-25
5,http://lorempixel.com/300/300/people,2013-07-08,Purus netus odio maecenas cum. Curae fusce urna. Netus nulla. Porta lacus per justo. Proin purus dolor platea vitae integer. Neque justo taciti id ut amet. Vitae morbi vehicula parturient. Velit magna primis at leo tristique pharetra platea mollis lorem potenti litora.,http://lorempixel.com/300/300/people,Toucan Island|Oak Orchards|Choctaw Canyon,Brenda Orzechowski,Syble Flynn,2013-05-04
2,http://lorempixel.com/300/300/people,2012-09-07,Augue proin. Etiam lorem netus. Netus fusce mauris fames eu elementum porta fames lectus ante consectetuer et morbi purus blandit orci. Felis augue eleifend dui dolor risus magna augue imperdiet tortor. Lorem donec risus erat dui nam non at lacus dignissim facilisi purus venenatis mollis mattis. Donec porta magna phasellus. Class fames pharetra ac. Ipsum etiam magnis donec commodo curae magna.,http://lorempixel.com/300/300/people,Lynx Mount,Eleonor Mclachlan,Teresita Cory,2012-06-25
4,http://lorempixel.com/300/300/people,2013-01-23,Curae neque volutpat phasellus ad consequat lorem pharetra proin in urna. Augue velit mattis varius fames cum quis hac vivamus mollis nam taciti in venenatis lacinia fusce. Felis risus justo porttitor sapien eget mattis sed. Massa lorem nisi vel proin laoreet nonummy semper felis habitasse pharetra congue. Porta lorem mollis rutrum. Nulla morbi cum elit. Magna etiam maecenas amet varius adipiscing pulvinar odio commodo mi. Purus neque vel.,http://lorempixel.com/300/300/people,The City at Chippewa Creek|Angler's Meadows|Captain's Beach,Carly Toro,Bud Carrow,2013-01-11
3,http://lorempixel.com/300/300/people,2013-05-29,Proin netus. Fames risus tempus proin. Augue felis risus egestas venenatis torquent. Risus fames nisi senectus nec euismod a mauris. Fames magna cras commodo ac arcu donec. Massa justo cum etiam massa orci. Lacus neque erat ut donec mauris. Etiam purus metus.,http://lorempixel.com/300/300/people,Whaler's Timbers|Azalea Overlook|Muskrat Prospect,Laurinda Franson,Melanie Bricker,2013-03-19
2,http://lorempixel.com/300/300/people,2012-10-22,Purus proin litora enim at pellentesque sodales. Dolor purus nullam. Nulla lorem hac porta tincidunt molestie in fames aptent adipiscing porta nibh sed. Lorem fames donec arcu est neque ultricies quisque congue et pede aptent orci pellentesque id. Donec morbi litora tempor posuere in nostra id pharetra. Donec netus fusce varius nisi magnis vestibulum felis enim in odio. Vitae donec penatibus rutrum erat tristique sociis ac malesuada porta. Fusce velit litora pellentesque ultricies fames dolor gravida.,http://lorempixel.com/300/300/people,Palm Bay,Ellsworth Rehman,Marcia Chabot,2012-09-18
4,http://lorempixel.com/300/300/people,2012-11-28,Augue porta ultrices habitasse a. Magna purus sit etiam varius. Etiam justo massa condimentum vehicula duis. Risus ipsum donec rutrum neque. Nulla proin curae rhoncus. Fusce netus praesent eni et molestie massa in congue. Metus curae vel mus cum sollicitudin ligula ipsum nulla mollis. Lacus augue varius parturient neque feugiat congue imperdiet facilisi.,http://lorempixel.com/300/300/people,Salisbury Mesa|Owl Brook|Macaw Shore,Jeannette Leick,Henriette Diedrich,2012-11-08
1,http://lorempixel.com/300/300/people,2012-02-15,Donec augue luctus penatibus curae ut donec diam. Justo metus hac fames velit sapien ullamcorper. Augue magna accumsan velit et. Dolor ipsum. Proin lorem vitae magna gravida duis et nullam conubia eget nibh egestas. Proin porta. Massa purus faucibus augue ad tortor ad tempor maecenas nibh non. Justo risus litora nisi ullamcorper aliquet vel mollis.,http://lorempixel.com/300/300/people,Banyan Lagoon,Del Smithey,Alysha Lococo,2012-01-06
4,http://lorempixel.com/300/300/people,2012-11-16,Fames netus maecenas sem curae hendrerit interdum. Velit curae. Class ipsum interdum cum etiam venenatis pretium velit nisi nulla. Fusce massa habitant mi semper. Proin morbi. Justo augue. Magna nulla lorem tortor habitant vivamus enim duis. Proin metus mollis at suscipit enim eu.,http://lorempixel.com/300/300/people,Puerto Rojo|Angler's Corner|The Knoll at Blue Spruce Inlet,Lonnie Rye,Hilda Hisey,2012-10-12
5,http://lorempixel.com/300/300/people,2012-05-11,Neque vitae. Massa etiam. Magna justo felis non ante consectetuer accumsan neque ve. Fusce dolor fusce mollis auctor gravida elit sem risus vitae nulla a congue. Neque felis dolor sit ultrices. Curae vitae. Massa augue vehicula proin est facilisi a placerat per pede ridiculus eleifend lacus. Etiam justo tempus consectetuer hendrerit morbi.,http://lorempixel.com/300/300/people,Shady Pasture|Cougar Woods|Banyan Inlet,Reiko Oppenheimer,Augustine Failla,2012-05-08
3,http://lorempixel.com/300/300/people,2012-10-26,Augue proin metus justo fusce leo fusce lacus non quis. Lorem risus pharetra ut velit primis lobortis sem quam dui. Fusce vitae. Curae fames egestas. Felis metus mauris nascetur tincidunt ac. Purus fames leo morbi hendrerit. Nulla magna massa aptent pellentesque natoque dolor. Curae netus litora montes sagittis nunc malesuada in.,http://lorempixel.com/300/300/people,Grizzly Harbor|The Streams at Moose View,Lecia Harling,Sharri Dietrich,2012-09-05
3,http://lorempixel.com/300/300/people,2012-08-24,Class morbi metus suscipit. Purus metus. Ipsum metus volutpat velit nulla lobortis eu dolor at. Proin etiam. Porta curae luctus ve dolor vel odio. Morbi purus tempor adipiscing dolor iaculis vitae eget egestas. Purus justo magnis. Vitae justo.,http://lorempixel.com/300/300/people,Wessex Vale,Hana Turnipseed,Luther Cybart,2012-06-23
2,http://lorempixel.com/300/300/people,2012-12-15,Morbi purus congue in litora per. Augue massa dictum erat lacinia ad nonummy orci. Fusce magna a arcu eu neque felis. Proin lorem neque aliquet quisque fringilla odio pede massa integer. Magna ipsum proin non risus porttitor parturient dui proin. Etiam velit aenean. Magna porta euismod est mi varius hymenaeos neque nisl mus amet vestibulum mus. Class dolor enim arcu vestibulum nisl.,http://lorempixel.com/300/300/people,Wessex Vale,Tomika Shimer,Luther Cybart,2012-11-23
2,http://lorempixel.com/300/300/people,2012-02-17,Risus porta leo. Lacus augue. Lorem neque odio condimentum ut litora egestas enim elit sapien laoreet. Vitae nulla senectus parturient nonummy sed curabitur risus bibendum risus pellentesque placerat. Augue netus vitae litora porta. Augue curae eros hymenaeos ad congue senectus mattis. Massa justo. Porta donec nullam consectetuer viverra elit ac duis porta varius.,http://lorempixel.com/300/300/people,Tanager Vale,Lecia Harling,Blaine Sevin,2012-01-23
3,http://lorempixel.com/300/300/people,2013-01-26,Neque lorem platea dictumst imperdiet sed nibh. Lorem porta vitae massa orci risus taciti turpis sem rutrum sit. Lorem velit orci sit netus aliquam nonummy quam maecenas molestie mollis dictum nulla vivamus eleifend lorem quis amet. Magna felis. Dolor nulla ante pede nisl conubia lorem metus nec enim penatibus. Proin nulla elementum phasellus eros urna quis egestas at. Massa nulla elit fames ridiculus sociosqu. Class netus fusce risus non ipsum dui.,http://lorempixel.com/300/300/people,Valle Viejo,Lelia Coppinger,Clarice Ly,2013-01-11
1,http://lorempixel.com/300/300/people,2012-05-17,Netus class nulla magnis nulla nunc id nisl at. Velit ipsum nullam est tellus ac aenean bibendum suspendisse. Fusce nulla. Massa magna etiam. Risus proin platea eget nisl tempus. Morbi metus erat curabitur at imperdiet posuere etiam massa dis duis dui. Risus velit. Nulla metus.,http://lorempixel.com/300/300/people,The Village at Bear Firth|Bridgwater Leap|Sweet Knoll,Gilda Puffer,Ronda Mandujano,2012-03-09
4,http://lorempixel.com/300/300/people,2012-08-13,Velit porta etiam sapien. Proin massa mollis magna orci blandit. Fusce purus. Fusce porta. Class felis. Etiam neque lacinia facilisis id venenatis ipsum a pede at. Risus felis. Justo massa.,http://lorempixel.com/300/300/people,Spruce Ridge|Gentle Quarter,Carly Toro,Letha Lehto,2012-05-27
4,http://lorempixel.com/300/300/people,2013-02-18,Justo donec. Massa class. Risus curae aenean mauris amet suspendisse cubilia. Massa morbi donec gravida venenatis ante cum proin etiam eleifend vestibulum lacinia eget. Lacus metus erat hymenaeos. Lacus vitae nullam etiam. Donec nulla iaculis pede. Etiam donec litora aenean in litora placerat.,http://lorempixel.com/300/300/people,Maple Farms,Berniece Sulton,Bridgette Efird,2013-01-01
4,http://lorempixel.com/300/300/people,2013-05-26,Purus metus turpis semper fusce phasellus ut tincidunt a. Purus ipsum platea accumsan eros nunc. Etiam neque sapien mattis in ante dolor magna aliquam gravida rutrum elit. Neque magna mattis risus posuere habitant magnis. Curae ipsum cursus lorem pharetra est natoque mi. Risus netus leo erat parturient enim congue parturient sollicitudin feugiat. Vitae donec. Justo purus vel purus curabitur fringilla curae eu.,http://lorempixel.com/300/300/people,Wooded Pasture,Kenda Scarboro,Coral Crossett,2013-05-04
2,http://lorempixel.com/300/300/people,2013-05-23,Velit lacus quam ac ipsum et pede torquent lacus eget ut justo curabitur imperdiet. Lacus dolor nec netus erat aenean. Vitae justo suspendisse amet urna sem metus felis laoreet maecenas. Proin morbi mauris accumsan per potenti habitant ante dapibus ad quam felis. Risus curae leo nisi a duis. Dolor vitae bibendum class eni. Etiam vitae quisque gravida vulputate facilisi platea libero. Felis morbi a cubilia eu.,http://lorempixel.com/300/300/people,Heron Waves|Flamingo Waves|The Forest at Essex Knoll,Candice Vidrio,Florine Lintner,2013-04-01
4,http://lorempixel.com/300/300/people,2013-04-19,Etiam dolor cum. Massa morbi sapien quam sed a mollis. Etiam class pretium nunc suscipit lorem urna. Metus donec proin turpis eget ante sodales convallis. Ipsum fames sem posuere aptent ve. Proin neque felis molestie adipiscing laoreet odio ut sollicitudin. Dolor augue. Ipsum lacus suspendisse suscipit facilisis sollicitudin feugiat eleifend eros nibh vivamus in.,http://lorempixel.com/300/300/people,Liberty Corner|Poplar Highlands,Lucinda Stracener,Lillian Ristau,2013-03-20
1,http://lorempixel.com/300/300/people,2013-05-31,Curae metus curae netus sodales arcu inceptos ve justo pellentesque risus. Fusce curae. Fusce class ornare diam dapibus. Porta proin viverra mi litora. Etiam felis. Metus lacus conubia nibh at consectetuer mollis morbi. Nulla lorem non duis justo. Massa proin sagittis donec hac tempor molestie.,http://lorempixel.com/300/300/people,Pleasant Parish,Kemberly Lecuyer,Candice Madonna,2013-04-01
4,http://lorempixel.com/300/300/people,2012-06-07,Justo porta per class vitae nostra cras. Purus netus sodales dapibus quis pellentesque adipiscing orci. Felis donec nibh a massa. Porta vitae conubia ad fermentum massa morbi. Risus velit taciti. Fames lorem facilisi cum dolor non dolor dui. Class donec hac. Risus netus elit suscipit interdum ve suspendisse.,http://lorempixel.com/300/300/people,Graceful Lagoon|Admiral's Island|Madera Azul,Kera Cybart,Marget Lehn,2012-06-03
5,http://lorempixel.com/300/300/people,2013-03-07,Vitae velit varius nunc leo duis nec ante feugiat ut. Class ipsum. Velit magna. Etiam curae augue risus turpis lacus sem arcu eros senectus sollicitudin. Etiam netus suspendisse amet hendrerit id nostra id mi arcu magnis integer aliquam habitasse. Massa class risus nibh cras quam. Nulla justo montes pulvinar turpis sociis cubilia. Class nulla.,http://lorempixel.com/300/300/people,Walnut Streams|Oak Haven|Iroquois Vineyard,Birgit Shires,Tonie Pille,2012-12-12
2,http://lorempixel.com/300/300/people,2012-04-25,Lorem justo. Morbi proin orci lorem platea lectus vulputate nulla in. Fusce magna duis hendrerit mauris turpis purus vestibulum praesent. Vitae class massa velit. Dolor neque. Metus lacus nunc molestie. Metus neque tortor sit parturient netus pede vehicula adipiscing ridiculus. Dolor metus.,http://lorempixel.com/300/300/people,Magnolia Springs|Madera Buena,Lelia Coppinger,Gisele Michaels,2012-04-10
2,http://lorempixel.com/300/300/people,2013-05-30,Justo netus donec accumsan purus. Felis porta condimentum. Etiam porta etiam arcu nibh mus. Augue proin a quam class pretium. Donec ipsum ante senectus dui blandit id eu. Curae proin etiam vitae. Morbi proin. Class ipsum interdum at orci sagittis placerat lacus a.,http://lorempixel.com/300/300/people,Sandpiper Quay,Eleonor Mclachlan,Sherly Lembo,2013-05-14
3,http://lorempixel.com/300/300/people,2012-07-06,Fusce vitae. Neque proin. Purus lorem nunc nostra vestibulum consectetuer feugiat massa eget sodales commodo. Ipsum felis semper lectus sagittis condimentum. Velit vitae duis morbi senectus orci ante. Ipsum morbi molestie velit ve amet fames ultricies montes. Morbi dolor ante iaculis enim ad augue consectetuer facilisi morbi pellentesque. Donec etiam dis arcu non ipsum massa netus augue sociosqu.,http://lorempixel.com/300/300/people,The Park at Liberty Acres,Houston Walborn,Shantay Shivers,2012-06-22
3,http://lorempixel.com/300/300/people,2012-08-26,Fames justo enim tellus tristique tincidunt ipsum neque. Neque curae nisi. Proin lorem. Lacus etiam luctus morbi natoque et cras. Purus porta nulla ipsum nisi eu. Netus nulla eget dolor lorem lacus fusce semper hymenaeos ad libero viverra orci leo nulla auctor justo dolor. Vitae velit scelerisque interdum cubilia potenti. Dolor proin diam a nisi vestibulum aenean eu.,http://lorempixel.com/300/300/people,Wakefield Vale,Sharlene Chappell,Monika Han,2012-08-17
4,http://lorempixel.com/300/300/people,2012-01-30,Porta felis semper fusce mus ridiculus montes suscipit sed euismod. Morbi augue odio mollis nonummy ac leo ridiculus mauris ut phasellus duis suspendisse. Curae neque justo conubia libero ante et augue tempus. Risus etiam sociis nisi erat. Massa lorem ornare et sociosqu sapien nulla. Neque risus odio eu tincidunt conubia eget cras curae eleifend. Morbi curae. Morbi donec ante ut vitae amet.,http://lorempixel.com/300/300/people,Wandering Lakes|Aloha Beach,Cythia Doten,Lisha Belser,2012-01-04
